Year,Conference,Title,Topic 0,Topic 1
2013,"POPL","Towards fully automatic placement of security sanitizers and declassifiers - Benjamin Livshits Stephen Chong",6765.1893290865,0.1953709838
2013,"POPL","The principles and practice of probabilistic programming - Noah D. Goodman",911.9328439239,174.4518561464
2013,"POPL","A model-learner pattern for bayesian reasoning - Andrew D. Gordon Mihhail Aizatulin Johannes Borgstrom Guillaume Claret Thore Graepel Aditya V. Nori Sriram K. Rajamani Claudio Russo",5895.3019585796,1279.0827414907
2013,"POPL","Hyperstream processing systems - Kohei Suenaga Hiroyoshi Sekine Ichiro Hasuo",4041.0029451688,1866.3817549016
2013,"POPL","HALO - Dimitrios Vytiniotis Simon Peyton Jones Koen Claessen Dan Ros&#233;n",1566.9459695286,3942.4387305418
2013,"POPL","Sigma* - Matko Botin&#269;an Domagoj Babi&#263;",6578.1870743331,0.1976257373
2013,"POPL","Checking NFA equivalence with bisimulations up to congruence - Filippo Bonchi Damien Pous",769.1187229509,3970.2659771194
2013,"POPL","Synthesis of biological models from mutation experiments - Ali Sinan Koksal Yewen Pu Saurabh Srivastava Rastislav Bodik Jasmin Fisher Nir Piterman",6577.1880311547,0.1966689156
2013,"POPL","Cache and I/O efficent functional algorithms - Guy E. Blelloch Robert Harber",6066.1871358491,0.1975642212
2013,"POPL","Sub-polyhedral scheduling using (unit-)two-variable-per-inequality polyhedra - Ramakrishna Upadrasta Albert Cohen",6551.1878711096,0.1968289607
2013,"POPL","Optimizing data structures in high-level programs - Tiark Rompf Arvind K. Sujeeth Nada Amin Kevin J. Brown Vojin Jovanovic HyoukJoong Lee Manohar Jonnalagedda Kunle Olukotun Martin Odersky",7937.7321999849,37.6525000854
2013,"POPL","Principled parsing for indentation-sensitive languages - Michael D. Adams",1201.4092919690,4388.9754081014
2013,"POPL","The ramifications of sharing in data structures - Aquinas Hobor Jules Villard",3238.5687930802,4660.8159069901
2013,"POPL","Complete instantiation-based interpolation - Nishant Totla Thomas Wies",4469.4736902891,1620.9110097813
2013,"POPL","Automatic detection of floating-point exceptions - Earl T. Barr Thanh Vo Vu Le Zhendong Su",5790.1886316358,0.1960684345
2013,"POPL","Subjective auxiliary state for coarse-grained concurrency - Ruy Ley-Wild Aleksandar Nanevski",6493.7129307569,518.6717693134
2013,"POPL","POPL 2014 Preview - Suresh Jagannathan Peter Sewell",0.1923500352,0.1923500352
2013,"POPL","On the linear ranking problem for integer linear-constraint loops - Amir M. Ben-Amram Samir Genaim",5842.3817766871,3.0029233833
2013,"POPL","Advanced automata minimization - Richard Mayr Lorenzo Clemente",6114.6362552863,291.7484447841
2013,"POPL","Automating relatively complete verification of higher-order functional programs - Hiroshi Unno Tachio Terauchi Naoki Kobayashi",3142.0430881736,2516.3416118967
2013,"POPL","Abstraction and invariance for algebraically indexed types - Robert Atkey Patricia Johann Andrew Kennedy",779.7638873833,6064.6208126870
2013,"POPL","Static and dynamic semantics of NoSQL languages - V&#233;ronique Benzaken Giuseppe Castagna Kim Nguyen J&#233;r&#244;me Sim&#233;on",3491.3225683090,3715.0621317613
2012,"POPL","Presentation of the SIGPLAN distinguished achievement award to Sir Charles Antony Richard Hoare, FRS, FREng, FBCS; and interview - Andrew P. Black Peter W. O'Hearn",277.3581125070,62.0265875634
2012,"POPL","Message of thanks - Tony Hoare",1001.9856810588,248.3990190115
2012,"POPL","Access permission contracts for scripting languages - Phillip Heidegger Annette Bieniusa Peter Thiemann",5971.4464910079,167.9382090624
2012,"POPL","Recursive proofs for inductive tree data-structures - Parthasarathy Madhusudan Xiaokang Qiu Andrei Stefanescu",6913.1883334386,0.1963666317
2012,"POPL","Symbolic finite state transducers - Margus Veanes Pieter Hooimeijer Benjamin Livshits David Molnar Nikolaj Bjorner",5053.1669597360,500.2177403343
2012,"POPL","Constraints as control - Ali Sinan K&#246;ksal Viktor Kuncak Philippe Suter",6422.9740881189,692.4106119515
2012,"POPL","Multiple facets for dynamic information flow - Thomas H. Austin Cormac Flanagan",5687.1873982273,0.1973018431
2012,"POPL","Defining code-injection attacks - Donald Ray Jay Ligatti",6212.5693234682,174.8153766021
2012,"POPL","Deciding choreography realizability - Samik Basu Tevfik Bultan Meriem Ouederni",5077.1868380906,0.1978619797
2012,"POPL","Analysis of recursively parallel programs - Ahmed Bouajjani Michael Emmi",6193.1884742719,0.1962257984
2012,"POPL","Programming languages for programmable networks - Jennifer Rexford",239.1885246896,0.1961753807
2012,"POPL","A compiler and run-time system for network programming languages - Christopher Monsanto Nate Foster Rob Harrison David Walker",7141.1858375992,0.1988624711
2012,"POPL","Freefinement - Stephan van Staden Cristiano Calcagno Bertrand Meyer",1176.5608030888,2909.8238969815
2012,"POPL","Nested refinements - Ravi Chugh Patrick M. Rondon Ranjit Jhala",3353.0984170652,3004.2862830051
2012,"POPL","An abstract interpretation framework for termination - Patrick Cousot Radhia Cousot",4334.3585263816,1159.0261736887
2012,"POPL","Playing in the grey area of proofs - Krystof Hoder Laura Kovacs Andrei Voronkov",2786.6716037994,2702.7130962709
2012,"POPL","Static and user-extensible proof checking - Antonis Stampoulis Zhong Shao",1050.8671603299,4957.5175397404
2012,"POPL","Run your research - Casey Klein John Clements Christos Dimoulas Carl Eastlund Matthias Felleisen Matthew Flatt Jay A. McCarthy Jon Rafkind Sam Tobin-Hochstadt Robert Bruce Findler",2421.1756130695,3564.2090870008
2012,"POPL","Verification of parameterized concurrent programs by modular reasoning about data and control - Azadeh Farzan Zachary Kincaid",5700.1892445548,0.1954555155
2012,"POPL","Resource-sensitive synchronization inference by abduction - Matko Botincan Mike Dodds Suresh Jagannathan",6541.1880138174,0.1966862529
2012,"POPL","Syntactic control of interference for separation logic - Uday S. Reddy John C. Reynolds",3949.9449680996,2154.4397319707
2012,"POPL","Canonicity for 2-dimensional type theory - Daniel R. Licata Robert Harper",0.1967789222,5410.1879211481
2012,"POPL","Algebraic foundations for effect-dependent optimisations - Ohad Kammar Gordon D. Plotkin",313.4954503175,5110.8892497528
2012,"POPL","Underspecified harnesses and interleaved bugs - Saurabh Joshi Shuvendu K. Lahiri Akash Lal",5180.1894934541,0.1952066163
2012,"POPL","On the power of coercion abstraction - Julien Cretin Didier R&#233;my",0.1966722866,5645.1880277837
2012,"POPL","Abstractions from tests - Mayur Naik Hongseok Yang Ghila Castelnuovo Mooly Sagiv",6136.1885703743,0.1961296960
2012,"POPL","Sound predictive race detection in polynomial time - Yannis Smaragdakis Jacob Evans Caitlin Sadowski Jaeheon Yi Cormac Flanagan",6241.1891004427,0.1955996277
2012,"POPL","Towards nominal computation - Mikolaj Bojanczyk Laurent Braud Bartek Klin Slawomir Lasota",192.9487188442,5097.4359812262
2012,"POPL","Programming with binders and indexed data-types - Andrew Cave Brigitte Pientka",141.8183707092,5644.5663293612
2012,"POPL","Meta-level features in an industrial-strength theorem prover - J. Strother Moore",341.1809880411,112.2037120292
2012,"POPL","Formalizing the LLVM intermediate representation for verified program transformations - Jianzhou Zhao Santosh Nagarakatte Milo M.K. Martin Steve Zdancewic",7147.1875000900,0.1971999804
2012,"POPL","Randomized accuracy-aware program transformations for efficient approximate computations - Zeyuan Allen Zhu Sasa Misailovic Jonathan A. Kelner Martin Rinard",6952.1882196837,0.1964803866
2012,"POPL","A rely-guarantee-based simulation for verifying concurrent program transformations - Hongjin Liang Xinyu Feng Ming Fu",6521.1881178199,0.1965822505
2012,"POPL","A unified approach to fully lazy sharing - Thibaut Balabonski",137.6230463223,5372.7616537480
2012,"POPL","Towards a program logic for JavaScript - Philippa Anne Gardner Sergio Maffeis Gareth David Smith",6533.8005267541,2.5841733162
2012,"POPL","The ins and outs of gradual type inference - Aseem Rastogi Avik Chaudhuri Basil Hosmer",4018.9416644774,2710.4430355929
2012,"POPL","Edit lenses - Martin Hofmann Benjamin Pierce Daniel Wagner",4189.3711729189,1961.0135271515
2012,"POPL","Clarifying and compiling C/C++ concurrency - Mark Batty Kayvan Memarian Scott Owens Susmit Sarkar Peter Sewell",6620.1875256532,0.1971744171
2012,"POPL","A mechanized semantics for C++ object construction and destruction, with applications to resource management - Tahina Ramananandro Gabriel Dos Reis Xavier Leroy",5706.1549338808,112.2297661895
2012,"POPL","An executable formal semantics of C with applications - Chucky Ellison Grigore Rosu",5814.7410283089,312.6436717616
2012,"POPL","A type theory for probability density functions - Sooraj Bhat Ashish Agarwal Richard Vuduc Alexander Gray",4673.2732249781,1236.1114750923
2012,"POPL","A type system for borrowing permissions - Karl Naden Robert Bocchino Jonathan Aldrich Kevin Bierhoff",6270.1866864417,0.1980136286
2012,"POPL","Self-certification - Pierre-Yves Strub Nikhil Swamy Cedric Fournet Juan Chen",4803.1524467346,2737.2322533357
2012,"POPL","Higher-order functional reactive programming in bounded space - Neelakantan R. Krishnaswami Nick Benton Jan Hoffmann",1354.6057079128,4340.7789921575
2012,"POPL","The marriage of bisimulations and Kripke logical relations - Chung-Kil Hur Derek Dreyer Georg Neis Viktor Vafeiadis",1203.0376405630,5360.3470595074
2012,"POPL","Information effects - Roshan P. James Amr Sabry",889.5443251120,3523.8403749583
2012,"POPL","A language for automatically enforcing privacy policies - Jean Yang Kuat Yessenov Armando Solar-Lezama",5655.9824058583,236.4022942120
2012,"POPL","Probabilistic relational reasoning for differential privacy - Gilles Barthe Boris K&#246;pf Federico Olmedo Santiago Zanella B&#233;guelin",4766.7705219582,157.6141781122
2014,"POPL","Modular reasoning about concurrent higher-order imperative programs - Lars Birkedal",292.3276434107,164.0570566596
2014,"POPL","A galois connection calculus for abstract interpretation - Patrick` Cousot Radhia Cousot",651.4575920735,486.9271079968
2014,"POPL","NetKAT - Carolyn Jane Anderson Nate Foster Arjun Guha Jean-Baptiste Jeannin Dexter Kozen Cole Schlesinger David Walker",5194.1438552579,1154.2408448124
2014,"POPL","Bias-variance tradeoffs in program analysis - Rahul Sharma Aditya V. Nori Alex Aiken",5595.1887644853,0.1959355851
2014,"POPL","Abstract satisfaction - Vijay D'Silva Leopold Haller Daniel Kroening",4512.5432470510,1457.8414530194
2014,"POPL","Proofs that count - Azadeh Farzan Zachary Kincaid Andreas Podelski",6432.1878379708,0.1968620996
2014,"POPL","A verified information-flow architecture - Arthur Azevedo de Amorim Nathan Collins Andr&#233; DeHon Delphine Demange C&#259;t&#259;lin Hri&#355;cu David Pichardie Benjamin C. Pierce Randy Pollack Andrew Tolmach",8347.1865361948,0.1981638755
2014,"POPL","CakeML - Ramana Kumar Magnus O. Myreen Michael Norrish Scott Owens",5624.1760708705,1801.2086291999
2014,"POPL","Probabilistic relational verification for cryptographic implementations - Gilles Barthe C&#233;dric Fournet Benjamin Gr&#233;goire Pierre-Yves Strub Nikhil Swamy Santiago Zanella-B&#233;guelin",5833.3379842365,1525.0467158338
2014,"POPL","Bridging boolean and quantitative synthesis using smoothed proof search - Swarat Chaudhuri Martin Clochard Armando Solar-Lezama",5653.1868998424,0.1978002280
2014,"POPL","A constraint-based approach to solving games on infinite graphs - Tewodros Beyene Swarat Chaudhuri Corneliu Popeea Andrey Rybalchenko",6109.1876778037,0.1970222666
2014,"POPL","Sound compilation of reals - Eva Darulova Viktor Kuncak",6675.1888955133,0.1958045571
2014,"POPL","Polymorphic functions with set-theoretic types - Giuseppe Castagna Kim Nguyen Zhiwu Xu Hyeonseung Im Sergue&#239; Lenglet Luca Padovani",33.9343736487,6865.4503264216
2014,"POPL","30 years of research and development around Coq - G&#233;rard Huet Hugo Herbelin",84.1969223835,185.1877776868
2014,"POPL","The essence of Reynolds - Stephen Brookes Peter W. O'Hearn Uday Reddy",998.9795831441,1738.4051169262
2014,"POPL","Freeze after writing - Lindsey Kuper Aaron Turon Neelakantan R. Krishnaswami Ryan R. Newton",6999.4523707234,316.9323293469
2014,"POPL","Replicated data types - Sebastian Burckhardt Alexey Gotsman Hongseok Yang Marek Zawirski",7657.1877851280,0.1969149424
2014,"POPL","Verifying eventual consistency of optimistic replication systems - Ahmed Bouajjani Constantin Enea Jad Hamza",6377.6784274719,203.7062725985
2014,"POPL","On coinductive equivalences for higher-order probabilistic functional programs - Ugo Dal Lago Davide Sangiorgi Michele Alberti",162.6543147558,5338.7303853145
2014,"POPL","Probabilistic coherence spaces are fully abstract for probabilistic PCF - Thomas Ehrhard Christine Tasson Michele Pagani",548.6728826711,4195.7118173992
2014,"POPL","Tabular - Andrew D. Gordon Thore Graepel Nicolas Rolland Claudio Russo Johannes Borgstrom John Guiver",5941.8295364539,874.5551636164
2014,"POPL","Modular, higher-order cardinality analysis in theory and practice - Ilya Sergey Dimitrios Vytiniotis Simon Peyton Jones",2784.7633594694,2299.6213406009
2014,"POPL","Profiling for laziness - Stephen Chang Matthias Felleisen",5184.4788647206,617.9058353498
2014,"POPL","Backpack - Scott Kilpatrick Derek Dreyer Simon Peyton Jones Simon Marlow",752.6849338808,6493.6997661895
2014,"POPL","Fair reactive programming - Andrew Cave Francisco Ferreira Prakash Panangaden Brigitte Pientka",790.3190958061,4540.0656042643
2014,"POPL","Optimal dynamic partial order reduction - Parosh Abdulla Stavros Aronis Bengt Jonsson Konstantinos Sagonas",6068.1874272994,0.1972727710
2014,"POPL","Modular reasoning about heap paths via effectively propositional formulas - Shachar Itzhaky Anindya Banerjee Neil Immerman Ori Lahav Aleksandar Nanevski Mooly Sagiv",5168.1881010483,0.1965990221
2014,"POPL","A sound and complete abstraction for reasoning about parallel prefix sums - Nathan Chong Alastair F. Donaldson Jeroen Ketema",6474.3783983514,16.0063017188
2014,"POPL","Authenticated data structures, generically - Andrew Miller Michael Hicks Jonathan Katz Elaine Shi",6312.1244519959,598.2602480743
2014,"POPL","Gradual typing embedded securely in JavaScript - Nikhil Swamy Cedric Fournet Aseem Rastogi Karthikeyan Bhargavan Juan Chen Pierre-Yves Strub Gavin Bierman",7151.7170693685,684.6676307019
2014,"POPL","Sound input filter generation for integer overflow errors - Fan Long Stelios Sidiroglou-Douskos Deokhwan Kim Martin Rinard",7923.1886583925,0.1960416778
2014,"POPL","Parametric completeness for separation theories - James Brotherston Jules Villard",92.1546981106,4534.2300019598
2014,"POPL","Proof search for propositional abstract separation logics via labelled sequents - Zh&#233; H&#243;u Ranald Clouston Rajeev Gor&#233; Alwen Tiu",443.7295031234,4189.6551969469
2014,"POPL","A proof system for separation logic with magic wand - Wonyeol Lee Sungwoo Park",2229.6158152002,3330.7688848702
2014,"POPL","Combining proofs and programs in a dependently typed language - Chris Casinghino Vilhelm Sj&#246;berg Stephanie Weirich",405.1797264828,5201.2049735875
2014,"POPL","From parametricity to conservation laws, via Noether's theorem - Robert Atkey",515.0658311178,4483.3188689525
2014,"POPL","A relationally parametric model of dependent type theory - Robert Atkey Neil Ghani Patricia Johann",0.1959216636,6404.1887784066
2014,"POPL","Game semantics for interface middleweight Java - Andrzej S. Murawski Nikos Tzevelekos",884.9926749867,3777.3920250837
2014,"POPL","Abstract acceleration of general linear loops - Bertrand Jeannet Peter Schrammel Sriram Sankaranarayanan",4876.1879594715,0.1967405988
2014,"POPL","Minimization of symbolic automata - Loris D'Antoni Margus Veanes",5782.4083500691,203.9763500012
2014,"POPL","Consistency analysis of decision-making programs - Swarat Chaudhuri Azadeh Farzan Zachary Kincaid",5957.7725840983,20.6121159720
2014,"POPL","Toward general diagnosis of static errors - Danfeng Zhang Andrew C. Myers",5713.3532976349,799.0314024354
2014,"POPL","Counter-factual typing for debugging type errors - Sheng Chen Martin Erwig",2901.6730062865,3074.7116937838
2014,"POPL","Battery transition systems - Udi Boker Thomas A. Henzinger Arjun Radhakrishna",5672.1881144851,0.1965855853
2014,"POPL","Symbolic optimization with SMT solvers - Yi Li Aws Albarghouthi Zachary Kincaid Arie Gurfinkel Marsha Chechik",6297.1877406200,0.1969594504
2014,"POPL","Tracing compilation by abstract interpretation - Stefano Dissegna Francesco Logozzo Francesco Ranzato",5228.1700738155,217.2146262549
2014,"POPL","Abstract effects and proof-relevant logical relations - Nick Benton Martin Hofmann Vivek Nigam",1711.9217370945,4287.4629629758
2014,"POPL","Parametric effect monads and semantics of effect systems - Shin-ya Katsumata",135.5054718605,5483.8792282099
2014,"POPL","Applying quantitative semantics to higher-order quantum computing - Michele Pagani Peter Selinger Beno&#238;t Valiron",155.8240193113,5025.5606807590
2014,"POPL","A nonstandard standardization theorem - Beniamino Accattoli Eduardo Bonelli Delia Kesner Carlos Lombardi",8.4486007567,5912.9360993137
2014,"POPL","Closed type families with overlapping equations - Richard A. Eisenberg Dimitrios Vytiniotis Simon Peyton Jones Stephanie Weirich",226.1378714422,6060.2468286281
2014,"POPL","A type-directed abstraction refinement approach to higher-order model checking - Steven J. Ramsay Robin P. Neatherway C.-H. Luke Ong",1838.3431686144,4008.0415314560
2014,"POPL","Fissile type analysis - Devin Coughlin Bor-Yuh Evan Chang",7971.1877360998,0.1969639703
2014,"POPL","A trusted mechanised JavaSript specification - Martin Bodin Arthur Chargueraud Daniele Filaretti Philippa Gardner Sergio Maffeis Daiva Naudziuniene Alan Schmitt Gareth Smith",7370.8500761704,336.5346239000
2014,"POPL","An operational and axiomatic semantics for non-determinism and sequence points in C - Robbert Krebbers",4570.9622691151,834.4224309552
1977,"POPL","A complete and consistent hoare axiomatics for a simple programming language - J. Cherniavsky S. Kamin",280.7242857183,1395.6604143521
1977,"POPL","Programming language constructs for which it is impossible to obtain good hoare-like axiom systems - Edmund Melson Clarke",1437.5012152280,2318.8834848423
1977,"POPL","Symbolic evaluation and the global value graph - John H. Reif Harry R. Lewis",597.0251604064,4751.3595396636
1977,"POPL","An interprocedural data flow analysis algorithm - Jeffrey M. Barth",4305.9452941440,0.4394059263
1977,"POPL","Implementation of an array bound checker - Norihisa Suzuki Kiyoshi Ishihata",3292.9765239993,1.4081760711
1977,"POPL","The evolution of programs - Nachum Dershowitz Zohar Manna",3725.1877517027,0.1969483677
1977,"POPL","Parallel program correctness through refinement - Thomas W. Doeppner",1954.4072653242,2959.9774347462
1977,"POPL","Generalized left corner parsing - Alan J. Demers",12.7914763275,3225.5932237429
1977,"POPL","Elimination of single productions from LR parsers in conjunction with the use of default reductions - Eljas Soisalon-Soininen",0.1969860310,2829.1877140393
1977,"POPL","The competence/performance dichotomy in programming preliminary report - Vaughan R. Pratt",1923.1692400161,849.2154600543
1977,"POPL","Structuring - Eric C. R. Hehner",1034.0884511514,409.2962489189
1977,"POPL","Social processes and proofs of theorems and programs - Richard A. DeMillo Richard J. Lipton Alan J. Perlis",1068.3233525042,1608.0613475662
1977,"POPL","Code-generation for machines with multiregister operations - A. V. Aho S. C. Johnson J. D. Ullman",2081.4994458592,124.8852542112
1977,"POPL","Minimal and optimal computations of recursive programs - G&#233;rard Berry Jean-Jacques L&#233;vy",0.1965544734,3374.1881455970
1977,"POPL","Threshold evaluation and the semantics of call by value, assignment and generic procedures - Bernard Lang",34.6414079781,3153.7432920921
1977,"POPL","Abstract interpretation - Patrick Cousot Radhia Cousot",787.7460390838,3641.6386609866
1977,"POPL","The equivalence problem for program schemata with nonintersecting loops - Harry R. Lewis",682.7495211827,3321.6351788876
1977,"POPL","Synchronization in actor systems - Russell Atkinson Carl Hewitt",4112.1887680102,0.1959320601
1977,"POPL","A new strategy for code generation - William Harrison",2310.1877630672,0.1969370032
1977,"POPL","Applications of high level control flow - Barry K. Rosen",2554.0882113942,145.2964886762
1977,"POPL","Generalized common subexpressions in very high level languages - Amelia C. Fong",956.2854552012,1488.0992448692
1977,"POPL","Expression continuity and the formal differentiation of algorithms - Bob Paige J. T. Schwartz",1207.0583081466,1412.3263919237
1977,"POPL","Applications of a graph grammar for program control flow analysis - Ken Kennedy Linda Zucconi",961.2120079022,1074.1726921681
1977,"POPL","On the covering of left recursive grammars - A. Nijholt",0.1959668521,2306.1887332183
1977,"POPL","An efficient insertion-only error-corrector for LL(1) parsers - C. N. Fischer D. R. Milton S. B. Quiring",417.1908476924,1330.1938523780
1976,"POPL","The influence of productions on derivations and parsing (Extended Abstract) - Benton L. Leong Detlef Wotschke",0.1950493053,2176.1896507650
1976,"POPL","A complexity theory of grammar problems - H. B. Hunt",0.1959246040,1864.1887754663
1976,"POPL","An algorithm for structuring programs (Extended Abstract) - Brenda S. Baker",2720.1880786283,0.1966214420
1976,"POPL","On directly constructing LR(k) parsers without chain reductions - Wilf R. LaLonde",26.3109204800,1804.0737795903
1976,"POPL","PLAN2D - syntactic analysis of precedence graph grammars - Reinhold Franck",275.4594402434,953.9252598270
1976,"POPL","Program improvement by source to source transformation - David B. Loveman",4740.1876629804,0.1970370900
1976,"POPL","Goal-directed program transformation - Ben Wegbreit",2643.1547176469,1366.2299824235
1976,"POPL","Primitive recursive program transformation - R. S. Boyer J. S. Moore R. E. Shostak",52.4655662238,803.9191338465
1976,"POPL","Mathematical semantics and data flow programming - Paul R. Kosinski",616.3438526163,1050.0408474540
1976,"POPL","Procedure referencing environments in SL5 - Dianne E. Britton Frederick C. Druseiks Ralph E. Griswold David R. Hanson Richard A. Holmes",1396.4693083342,525.9153917361
1976,"POPL","Verifying formal specifications of synchronous processes - Patricia P. Griffiths Charles J. Prenner",4781.1876216363,0.1970784341
1976,"POPL","Test data as an aid in proving program correctness - Matthew Geller",3201.8519717821,123.5327282882
1976,"POPL","Code generation for expressions with common subexpressions (Extended Abstract) - A. V. Aho S. C. Johnson J. D. Ullman",2633.1434200789,286.2412799914
1976,"POPL","Automatic generation of efficient evaluators for attribute grammars - Ken Kennedy Scott K. Warren",1106.8790011208,3777.5056989496
1976,"POPL","Automatic design of data processing systems - Gregory R. Ruth",2646.1886940009,0.1960060695
1976,"POPL","Techniques for the automatic selection of data structures - James Low Paul Rovner",3187.1882512565,0.1964488138
1976,"POPL","A methodology for LISP program construction from examples - Phillip D. Summers",0.1923500352,0.1923500352
1976,"POPL","Binding time optimization in programming languages - Neil D. Jones Steven S. Muchnick",4165.0754859030,846.3092141673
1976,"POPL","A lazy evaluator - Peter Henderson James H. Morris",362.2935106594,2133.0911894109
1976,"POPL","Induction variables in very high level languages - Amelia C. Fong Jeffrey D. Ullman",1241.9593418044,695.4253582660
1975,"POPL","Application of lattice algebra to loop optimization - Amelia Fong John Kam Jeffrey Ullman",991.9144876410,913.4702124293
1975,"POPL","Node listings applied to data flow analysis - K. W. Kennedy",0.1923500352,0.1923500352
1975,"POPL","A description of path expressions by Petri nets - P. E. Lauer R. H. Campbell",1260.7069103937,1524.6777896766
1975,"POPL","Even simple programs are hard to analyze - Neil D. Jones Steven S. Muchnick",0.1923500352,0.1923500352
1975,"POPL","On the complexity of the circularity test for attribute grammars - M. Jazayeri W. F. Ogden W. C. Rounds",121.8173000994,2746.5673999709
1975,"POPL","On the complexity of LR(k) testing - Harry B. Hunt Thomas G. Szymanski Jeffrey D. Ullman",32.5855635052,1413.7991365652
1975,"POPL","Programming languages, natural languages, and mathematics - Peter Naur",1670.7892286440,1469.5954714263
1975,"POPL","Modes, values and expressions - Marvin Solomon",39.1211521664,2509.2635479039
1975,"POPL","An assertion language for data structures - Stephen A. Cook Derek C. Oppen",0.1923500352,0.1923500352
1975,"POPL","An algebraic model for string patterns - Glenn F. Stewart",66.5486561637,3510.8360439066
1975,"POPL","Program schemas with concurrency - Bruce P. Lester",1054.5895048329,465.7951952375
1975,"POPL","New control structures to aid gotolessness - D. M. Symes",563.6043113994,666.7803886709
1975,"POPL","A fast and usually linear algorithm for global flow analysis - Susan L. Graham Mark Wegman",2631.4621201025,1619.9225799678
1975,"POPL","Structured exception handling - John B. Goodenough",7050.1883688642,0.1963312061
1975,"POPL","An algebra of relations for machine computation - Patrick Hall Peter Hitchcock Stephen Todd",0.1923500352,0.1923500352
1975,"POPL","Computer assisted application definition - Martin Mikelsons",2677.9801326572,299.4045674131
1975,"POPL","Some optimization techniques for an extensible language - Christopher Ryland",152.4529065697,21.9317935007
1975,"POPL","Automatic data structure choice in a language of very high level - J. T. Schwartz",1291.4570589212,400.9276411492
1975,"POPL","A mathematical approach to language design - George T. Ligler",399.7924333808,2675.5922666896
