Year,Conference,Title,Topic 0,Topic 1
1975,"POPL","Correctness-preserving program transformations - Susan L. Gerhart",0.1923500352,0.1923500352
1975,"POPL","Actor semantics of PLANNER-73 - Irene Greif Carl Hewitt",3617.0436864343,494.3410136360
1975,"POPL","Reduction - Richard J. Lipton",483.0522740972,1275.3324259731
1975,"POPL","A semantic model for parallel systems with scheduling - Ellis S. Cohen",756.7328817405,1647.6518183299
1973,"POPL","Deterministic parsing of ambiguous grammars - A. V. Aho S. C. Johnson J. D. Ullman",170.7131848641,3904.6715152062
1973,"POPL","Strict deterministic versus LR(0) parsing - Matthew M. Geller Michael A. Harrison",0.1960209573,2529.1886791130
1973,"POPL","Types are not sets - James H. Morris",713.2145355640,534.1701645063
1973,"POPL","Recursively defined data types - C. H. Lewis B. K. Rosen",0.1923500352,0.1923500352
1973,"POPL","Mode modules as representations of domains - Alice E. Fischer Michael J. Fischer",928.5320007071,502.8526993632
1973,"POPL","Advice on structuring compilers and proving them correct - F. Lockwood Morris",63.0565123099,2051.3281877604
1973,"POPL","Actor induction and meta-evaluation - Carl Hewitt Peter Bishop Irene Greif Brian Smith Todd Matson Richard Steiger",731.3449234131,2489.0397766572
1973,"POPL","Reasoning about programs - Richard J. Waldinger Karl N. Levitt",2150.5758694124,1887.8088306579
1973,"POPL","Procedure linkage optimization working paper - A. Maggiolo-Schettini B. K. Rosen H. R. Strong",0.1923500352,0.1923500352
1973,"POPL","A unified approach to global program optimization - Gary A. Kildall",3943.6174121646,169.7672879057
1973,"POPL","Analysis of a simple algorithm for global data flow problems - Matthew S. Hecht Jeffrey D. Ullman",1663.3612711832,1035.0234288872
1973,"POPL","Transitions in extendible arrays - Arnold L. Rosenberg",909.7000919847,1001.6846080857
1973,"POPL","Labelled precedence parsing - Mario Schkolnick",48.5974227587,2396.7872773117
1973,"POPL","Large scale file processing - Gloria J. Lambert",3032.1881998151,0.1965002553
1973,"POPL","On the decision problems of program schemas with commutative and invertible functions - Ashok K. Chandra",264.3380540302,1742.0466460402
1973,"POPL","Top down operator precedence - Vaughan R. Pratt",1788.3197874893,2068.0649125811
1973,"POPL","Practical syntactic error recovery in compilers - Susan L. Graham Steven P. Rhodes",888.1450452243,1563.2396548460
1973,"POPL","A parallel approach to compilation - Mary Zosel",2775.9881529146,291.3965471558
1973,"POPL","Programming language semantics and closed applicative languages - John Backus",0.1923500352,0.1923500352
1973,"POPL","On the definitional method of standard PL/I - David Beech",669.5190950362,1097.8656050341
1973,"POPL","Mathematical semantics of SNOBOL4 - R. D. Tennent",251.5751564527,2049.8095436176
1973,"POPL","Formalization of EXEL - L. Nolin G. Ruggiu",138.3055386741,2231.0791613962
1979,"POPL","A compact, machine-independent peephole optimizer - Christopher W. Fraser",1614.1882371808,0.1964628896
1979,"POPL","A PL/CV precis - Robert L. Constable Scott D. Johnson",1011.0897499894,2162.2949500809
1979,"POPL","Universality of data retrieval languages - Alfred V. Aho Jeffrey D. Ullman",545.8411147696,2714.5435853007
1979,"POPL","Automatic generation of near-optimal linear-time translators for non-circular attribute grammars - Rina Cohen Eli Harry",818.3919495407,3826.9927505297
1979,"POPL","Space-time tradeoffs for linear recursion - Sowmitri Swamy John E. Savage",930.8338840636,1118.5508160067
1979,"POPL","Characterization and elimination of redundancy in recursive programs - Norman H. Cohen",1015.0380630701,3172.3466370003
1979,"POPL","The functional power of parameter passage mechanism - Adrienne Critcher",1785.3311499414,1975.0535501290
1979,"POPL","An interpreter generator using tree pattern matching - Christoph M. Hoffmann Michael J. O'Donnell",458.3985959328,2520.9861041375
1979,"POPL","Specifying programming language semantics - I. Greif A. Meyer",64.6321069604,3049.7525931099
1979,"POPL","Decisions for type in APL - W. E. Gull M. A. Jenkins",0.1923500352,0.1923500352
1979,"POPL","Automatic data structure selection in SETL - Edmond Schonberg Jacob T. Schwartz Micha Sharir",3308.0563210375,181.3283790328
1979,"POPL","Synthesis of resource invariants for concurrent programs - Edmund Melson Clarke",3132.7897551777,471.5949448927
1979,"POPL","Inductively computable constructs in very high level languages - Amelia C. Fong",820.1318751495,1025.2528249208
1979,"POPL","String pattern matching in polynomial time - K. C. Liu A. C. Fleck",149.3204799825,1241.0642200878
1979,"POPL","Predicate path expressions - Sten Andler",3038.0091371363,252.3755629340
1979,"POPL","Type checking in an imperfect world - Terrence C. Miller",0.1923500352,0.1923500352
1979,"POPL","Flow analysis and optimization of LISP-like structures - Neil D. Jones Steven S. Muchnick",1705.4391911227,1588.9455089476
1979,"POPL","Data flow analysis of communicating processes - John H. Reif",2683.4132687578,291.9714313126
1979,"POPL","Systematic design of program analysis frameworks - Patrick Cousot Radhia Cousot",617.6867054669,4578.6979946035
1979,"POPL","Certifying information flow properties of programs - Richard P. Reitman Gregory R. Andrews",2343.1882012471,0.1964988232
1979,"POPL","An efficient way to find the side effects of procedure calls and the aliases of variables - John P. Banning",3861.6371991258,70.7475009445
1979,"POPL","Principles of proving concurrent programs in Gypsy - Donald I. Good Richard M. Cohen James Keeton-Williams",3404.1882776252,0.1964224452
1979,"POPL","The evolution of list-copying algorithms and the need for structured program verification - Stanley Lee Willem P. deRoever Susan L. Gerhart",4421.4953829757,306.8893170946
1979,"POPL","First order programming logic - Robert Cartwright John McCarthy",209.4111552415,2835.9735448289
1979,"POPL","Recursion in logics of programs - David Harel",54.9349872783,3774.4497127920
1979,"POPL","Process logic - V. R. Pratt",0.1973902377,2476.1873098326
1979,"POPL","The logic of a relational data manipulation language - Marco A. Casanova Philip A. Bernstein",429.7095306378,2263.6751694325
1978,"POPL","Compilation and delayed evaluation in APL - Leo J. Guibas Douglas K. Wyatt",3341.3919871244,24.9927129459
1978,"POPL","The Smalltalk-76 programming system design and implementation - Daniel H. H. Ingalls",3093.1881537733,0.1965462971
1978,"POPL","A portable compiler - S. C. Johnson",2307.9851385318,135.3995615385
1978,"POPL","Automating proofs of the absence of common runtime errors - Steven M. German",5527.6535900050,238.7311100653
1978,"POPL","A Metalanguage for interactive proof in LCF - M. Gordon R. Milner L. Morris M. Newey C. Wadsworth",31.7957353202,3240.5889647502
1978,"POPL","Unrestricted procedure calls in Hoare's logic - Robert Cartwright Derek Oppen",1226.2575017792,2446.1271982911
1978,"POPL","A simplifier based on efficient decision algorithms - Greg Nelson Derek C. Oppen",754.1396442793,2650.2450557910
1978,"POPL","Reasoning about recursively defined data structures - Derek C. Oppen",199.1026720033,2045.2820280670
1978,"POPL","Off-line and on-line algorithms for deducing equalities - Peter Downey Hanan Samet Ravi Sethi",1488.0468845077,2945.3378155627
1978,"POPL","Verification and design aspects of true concurrency - David Mizell",1578.2067560510,144.1779440194
1978,"POPL","Almost control-free (indeterministic) parallel computation on permit schemes - Karel &#268;ul&#237;k",744.8485189568,1546.5361811135
1978,"POPL","Complexity of expressions allowing concurrency - W. F. Ogden W. E. Riddle W. C. Round",345.0962711383,2046.2884289320
1978,"POPL","Clauses - E. A. Ashcroft W. W. Wadge",1098.8879851159,822.4967149545
1978,"POPL","A partial evaluator, and its use for compiling iterative statements in LISP - Anders Haraldsson",1776.4971883111,316.8875117593
1978,"POPL","Nondeterminism in logics of programs - David Harel Vaughan R. Pratt",533.2833290556,3790.1013710147
1978,"POPL","A straightforward denotational semantics for non-determinate data flow programs - Paul R. Kosinski",165.0410068824,2306.3436931880
1978,"POPL","Efficient computation of expressions with common subexpressions - Bhaskaram Prabhala Ravi Sethi",1849.0433117272,851.3413883431
1978,"POPL","A new method for compiler code generation - R. Steven Glanville Susan L. Graham",2798.6759045768,620.7087954935
1978,"POPL","A forward move algorithm for LR error recovery - Thomas J. Pennello Frank DeRemer",375.0455798968,3957.3391201736
1978,"POPL","Local constraints in the syntax and semantics of programming languages - Aravind K. Joshi Leon S. Levy Kang Yueh",347.3637376400,2415.0209624304
1978,"POPL","Data types as values - Alan Demers James Donahue Glenn Skinner",907.9375199587,1957.4471801117
1978,"POPL","Type definitions with parameters - Marvin Solomon",57.7769967505,1140.6077033198
1978,"POPL","Syntactic control of interference - John C. Reynolds",1086.8172528160,1332.5674472543
1978,"POPL","Monoids for rapid data flow analysis - Barry K. Rosen",2720.8722718489,2310.5124282215
1978,"POPL","A general scheme for the automatic inference of variable types - Marc A. Kaplan Jeffrey D. Ullman",94.4363884617,4246.9483116087
1978,"POPL","Symbolic program analysis in almost linear time - John H. Reif",1455.0773065713,1236.3073934991
1978,"POPL","Automatic discovery of linear restraints among variables of a program - Patrick Cousot Nicolas Halbwachs",3220.2379766386,565.1467234317
1995,"POPL","Isolating side effects in sequential languages - Jon G. Riecke Ramesh Viswanathan",88.7910051780,4770.5936948924
1995,"POPL","Sequential algorithms, deterministic parallelism, and intensional expressiveness - Stephen Brookes Denis Dancanet",372.4928821489,3376.8918179214
1995,"POPL","Extensional polymorphism - Catherine Dubois Fran&#231;ois Rouaix Pierre Weis",36.7838665235,5028.6008335468
1995,"POPL","Compiling polymorphism using intensional type analysis - Robert Harper Greg Morrisett",315.3463280146,4951.0383720558
1995,"POPL","Applicative functors and fully transparent higher-order modules - Xavier Leroy",3.1196870325,4741.2650130379
1995,"POPL","Higher-order functors with transparent signatures - Sandip K. Biswas",0.1956054306,3111.1890946397
1995,"POPL","Structural decidable extensions of bounded quantification - Sergei G. Vorobyov",0.1959672686,3685.1887328017
1995,"POPL","Lower bounds on type inference with subtypes - My Hoang John C. Mitchell",0.1956349102,3592.1890651602
1995,"POPL","Positive subtyping - Martin Hofmann Benjamin Pierce",50.1986674385,3936.1860326318
1995,"POPL","The geometry of interaction machine - Ian Mackie",728.9953623280,2500.3893377423
1995,"POPL","The semantics of future and its use in program optimization - Cormac Flanagan Matthias Felleisen",1656.8244566479,2656.5602434224
1995,"POPL","Total correctness by local improvement in program transformation - David Sands",13.4352701851,4320.9494298852
1995,"POPL","Using functor categories to generate intermediate code - John C. Reynolds",1714.3547696183,2257.0299304520
1995,"POPL","A call-by-need lambda calculus - Zena M. Ariola John Maraist Martin Odersky Matthias Felleisen Philip Wadler",45.7241134631,3583.6605866073
1995,"POPL","Unification factoring for efficient execution of logic programs - S. Dawson C. R. Ramakrishnan I. V. Ramakrishnan K. Sagonas S. Skiena T. Swift D. S. Warren",1531.8094375443,3026.5752625261
1995,"POPL","Separation constraint partitioning - Klaus E. Schauser David E. Culler Seth C. Goldstein",5512.4413822584,80.9433178119
1995,"POPL","Default timed concurrent constraint programming - Vijay A. Saraswat Radha Jagadeesan Vineet Gupta",949.3340214755,4425.0506785948
1995,"POPL","A language with distributed scope - Luca Cardelli",4319.6079421910,244.7767578792
1995,"POPL","A formal model and specification language for procedure calling conventions - Mark W. Bailey Jack W. Davidson",5423.1289940269,22.2557060434
1995,"POPL","Obtaining sequential efficiency for concurrent object-oriented languages - John Plevyak Xingbin Zhang Andrew A. Chien",4237.1887062466,0.1959938238
1995,"POPL","Optimizing an ANSI C interpreter with superoperators - Todd A. Proebsting",3061.0402425114,46.3444575590
1995,"POPL","Monad transformers and modular interpreters - Sheng Liang Paul Hudak Mark Jones",117.3616559008,3764.0230441696
1995,"POPL","Structuring depth-first search algorithms in Haskell - David J. King John Launchbury",2005.2153777574,1943.1693223129
1995,"POPL","Demand-driven computation of interprocedural data flow - Evelyn Duesterwald Rajiv Gupta Mary Lou Soffa",5220.6761315851,95.7085684852
1995,"POPL","Time and space profiling for non-strict, higher-order functional languages - Patrick M. Sansom Simon L. Peyton Jones",1287.6978050379,3401.6868950325
1995,"POPL","A type system equivalent to flow analysis - Jens Palsberg Patrick O'Keefe",90.0159843308,2831.3687157395
1995,"POPL","Parametric program slicing - John Field G. Ramalingam Frank Tip",3186.9124328721,2552.4722671983
1995,"POPL","A unified treatment of flow analysis in higher-order languages - Suresh Jagannathan Stephen Weeks",1752.9991050304,2092.3855950399
1995,"POPL","Corrigendum: decidable bounded quantification - Giuseppe Castagna Benjamin C. Pierce",0.1974183540,324.1872817163
1995,"POPL","Precise interprocedural dataflow analysis via graph reachability - Thomas Reps Susan Horwitz Mooly Sagiv",4848.1878741550,0.1968259153
1995,"POPL","A linear time algorithm for placing &#966;-nodes - Vugranam C. Sreedhar Guang R. Gao",2832.3535805268,1591.0311195435
1995,"POPL","An extended form of must alias analysis for dynamic allocation - Rita Z. Altucher William Landi",4391.1879989667,0.1967011037
1995,"POPL","Reasoning about rings - E. Allen Emerson Kedar S. Namjoshi",441.8728608884,2333.5118391820
1995,"POPL","Verifying infinite state processes with sequential and parallel composition - Ahmed Bouajjani Rachid Echahed Peter Habermehl",0.1969848139,3807.1877152565
1995,"POPL","Structured operational semantics as a specification language - Bard Bloom",495.1767218100,3247.2079782604
1994,"POPL","Memory subsystem performance of programs using copying garbage collection - Amer Diwan David Tarditi Eliot Moss",4403.1883166727,0.1963833977
1994,"POPL","Correctness of trap-based breakpoint implementations - Norman Ramsey",2881.1886370902,0.1960629801
1994,"POPL","A type-theoretic approach to higher-order modules with sharing - Robert Harper Mark Lillibridge",0.1964225400,4807.1882775302
1994,"POPL","A type system for prototyping languages - Dinesh Katiyar David Luckham John Mitchell",2830.6430725157,2300.7416275547
1994,"POPL","Decidable bounded quantification - Giuseppe Castagna Benjamin C. Pierce",0.1963954643,3291.1883046061
1994,"POPL","Soft typing with conditional types - Alexander Aiken Edward L. Wimmers T. K. Lakshman",394.0833096542,3724.3013904161
1994,"POPL","Automated synthesis of interface adapters for reusable classes - Satish R. Thatt&#233;",744.6457164560,3639.7389836143
1994,"POPL","Implementation of the typed call-by-value &#955;-calculus using a stack of regions - Mads Tofte Jean-Pierre Talpin",1071.0316253468,2621.3530747236
1994,"POPL","Deriving algorithms from type inference systems - Chris Hankin Daniel Le M&#233;tayer",353.0357779124,2974.3489221579
1994,"POPL","Formally optimal boxing - Fritz Henglein Jesper J&#248;rgensen",103.9632553191,5257.4214447512
1994,"POPL","Combinations of abstract domains for logic programming - Agostino Cortesi Baudouin Le Charlier Pascal Van Hentenryck",977.1263007181,4283.2583993523
1994,"POPL","Analyzing logic programs with dynamic scheduling - Kim Marriott Mar&#237;a Jos&#233; Garc&#237;a de la Banda Manuel Hermenegildo",2782.2668279786,1507.1178720918
1994,"POPL","Dominators, super blocks, and program coverage - Hiralal Agrawal",3044.1890825835,0.1956174868
1994,"POPL","Higher-order equational logic programming - Zhenyu Qian",0.1953346857,4122.1893653847
1994,"POPL","A needed narrowing strategy - Sergio Antoy Rachid Echahed Michael Hanus",21.8010945441,3964.5836055263
1994,"POPL","Detecting pipeline structural hazards quickly - Todd A. Proebsting Christopher W. Fraser",1814.1884546220,0.1962454483
1994,"POPL","An incremental algorithm for maintaining the dominator tree of a reducible flowgraph - G. Ramalingam Thomas Reps",3089.1878946363,0.1968054340
1994,"POPL","Value dependence graphs - Daniel Weise Roger F. Crew Michael Ernst Bjarne Steensgaard",5311.1881344810,0.1965655893
1994,"POPL","Lazy array data-flow dependence analysis - Vadim Maslov",4767.6081272998,32.7765727706
1994,"POPL","An operational framework for value-passing processes - Rance Cleaveland Daniel Yankelevich",285.8575286243,3498.5271714460
1994,"POPL","CHOCOLATE: Calculi of Higher Order COmmunication and LAmbda TErms (preliminary report) - Bard Bloom",41.5055216495,2551.8791784209
1994,"POPL","Combinatory representation of mobile processes - Kohei Honda Nobuko Yoshida",0.1971038436,3761.1875962267
1994,"POPL","Multi-pass execution of functional logic programs - Jukka Paakki",896.2882742838,4208.0964257865
1994,"POPL","The typed polymorphic label-selective &#955;-calculus - Jacques Garrigue Hassan A&#239;t-Kaci",28.6950795495,3941.6896205209
1994,"POPL","Composing tree attributions - John Boyland Susan L. Graham",792.8425474773,3640.5421525930
1994,"POPL","A staging calculus and its application to the verification of translators (preliminary report) - Robert Muller",0.1962552874,2658.1884447829
1994,"POPL","Reducing indirect function call overhead in C++ programs - Brad Calder Dirk Grunwald",4062.1882545701,0.1964455002
1994,"POPL","Call forwarding - Koen De Bosschere Saumya Debray David Gudeman Sampath Kannan",0.1923500352,0.1923500352
1994,"POPL","The revival transformation - Lawrence Feigen David Klappholz Robert Casazza Xing Xue",1538.9666907800,859.4180092903
1994,"POPL","Selective and lightweight closure conversion - Mitchell Wand Paul Steckler",569.5937430859,2456.7909569845
1994,"POPL","Representing monads - Andrzej Filinski",0.1967139399,3985.1879861304
1994,"POPL","A generic account of continuation-passing styles - John Hatcliff Olivier Danvy",0.1956894292,4956.1890106411
1994,"POPL","Building interpreters by composing monads - Guy L. Steele",120.6710524468,5735.7136476233
1994,"POPL","A functional theory of local names - Martin Odersky",54.0516615357,3239.3330385346
1994,"POPL","From &#955;&#963; to &#955;&#957; - Pierre Lescanne",0.1974530695,2536.1872470009
1994,"POPL","Portable, unobtrusive garbage collection for multiprocessor systems - Damien Doligez Georges Gonthier",5351.1874723387,0.1972277317
1994,"POPL","Higher-order concurrent programs with finite communication topology (extended abstract) - Hanne Riis Nielson Flemming Nielson",252.3527905250,3159.0319095453
1994,"POPL","Proving concurrent constraint programs correct - Frank S. de Boer Maurizio Gabbrielli Elena Marchiori Catuscia Palamidessi",313.2397421235,3026.1449579468
1994,"POPL","Manifest types, modules, and separate compilation - Xavier Leroy",0.1961777657,5469.1885223046
1997,"POPL","Fast and accurate flow-insensitive points-to analysis - Marc Shapiro Susan Horwitz",0.1923500352,0.1923500352
1997,"POPL","Partitioning dataflow analyses using types - Erik Ruf",0.1923500352,0.1923500352
1997,"POPL","Parameterized types for Java - Joseph A. Bank Andrew C. Myers Barbara Liskov",0.1923500352,0.1923500352
1997,"POPL","Pizza into Java - Martin Odersky Philip Wadler",0.1923500352,0.1923500352
1997,"POPL","Determining the idle time of a tiling - Karin H&#246;gstedt Larry Carter Jeanne Ferrante",0.1923500352,0.1923500352
1997,"POPL","Model checking for programming languages using VeriSoft - Patrice Godefroid",0.1923500352,0.1923500352
1997,"POPL","Synchronization transformations for parallel computing - Pedro Diniz Martin Rinard",0.1923500352,0.1923500352
1997,"POPL","Maximizing parallelism and minimizing synchronization with affine transforms - Amy W. Lim Monica S. Lam",0.1923500352,0.1923500352
1997,"POPL","A Curry-Howard foundation for functional computation with control - C.-H. L. Ong C. A. Stewart",0.1923500352,0.1923500352
1997,"POPL","The &#960;-calculus in direct style - G&#233;rard Boudol",0.1923500352,0.1923500352
1997,"POPL","Behavioral equivalence in the polymorphic pi-calculus - Benjamin C. Pierce Davide Sangiorgi",0.1923500352,0.1923500352
1997,"POPL","Comparing the expressive power of the synchronous and the asynchronous &#960;-calculus - Catuscia Palamidessi",0.1923500352,0.1923500352
1997,"POPL","Shape types - Pascal Fradet Daniel Le M&#233;tayer",0.1923500352,0.1923500352
1997,"POPL","Program fragments, linking, and modularization - Luca Cardelli",0.1923500352,0.1923500352
1997,"POPL","Minimal typings in atomic subtyping - Jakob Rehof",0.1923500352,0.1923500352
1997,"POPL","Typing algorithm in type theory with inheritance - Amokrane Sa&#239;bi",0.1923500352,0.1923500352
1997,"POPL","Type checking higher-order polymorphic multi-methods - Fran&#231;ois Bourdoncle Stephan Merz",0.1923500352,0.1923500352
1997,"POPL","Types as abstract interpretations - Patrick Cousot",0.1923500352,0.1923500352
1997,"POPL","Infinitary control flow analysis - Flemming Nielson Hanne Riis Nielson",0.1923500352,0.1923500352
1997,"POPL","Automatic verification of parameterized linear networks of processes - David Lesens Nicolas Halbwachs Pascal Raymond",0.1923500352,0.1923500352
1997,"POPL","On the complexity of escape analysis - Alain Deutsch",0.1923500352,0.1923500352
1997,"POPL","A demand-driven set-based analysis - Sandip K. Biswas",0.1923500352,0.1923500352
1997,"POPL","Denotational semantics using an operationally-based term model - Mitchell Wand Gregory T. Sullivan",0.1923500352,0.1923500352
1997,"POPL","Objective ML - Didier R&#233;my J&#233;r&#244;me Vouillon",0.1923500352,0.1923500352
1997,"POPL","Constraints to stop higher-order deforestation - H. Seidl M. H. S&#248;rensen",0.1923500352,0.1923500352
1997,"POPL","Reducing nondeterminism while specializing logic programs - Alberto Pettorossi Maurizio Proietti Sophie Renault",0.1923500352,0.1923500352
1997,"POPL","From SOS rules to proof principles - David Sands",0.1923500352,0.1923500352
1997,"POPL","Relational parametricity and units of measure - Andrew J. Kennedy",0.1923500352,0.1923500352
1997,"POPL","High level reading and data structure compilation - Robert Paige Zhe Yang",0.1923500352,0.1923500352
1997,"POPL","PolyP&#8212;a polytypic programming language extension - Patrik Jansson Johan Jeuring",0.1923500352,0.1923500352
1997,"POPL","First-class polymorphism with type inference - Mark P. Jones",0.1923500352,0.1923500352
1997,"POPL","Rolling your own mutable ADT&#8212;a connection between linear types and monads - Chih-Ping Chen Paul Hudak",0.1923500352,0.1923500352
1997,"POPL","Search and imperative programming - Krzysztof R. Apt Andrea Schaerf",0.1923500352,0.1923500352
1997,"POPL","A unified computation model for functional and logic programming - Michael Hanus",0.1923500352,0.1923500352
1997,"POPL","Call by need computations to root-stable form - Aart Middeldorp",0.1923500352,0.1923500352
1997,"POPL","Proof-carrying code - George C. Necula",0.1923500352,0.1923500352
1997,"POPL","Does &#8220;just in time&#8221; = &#8220;better late than never&#8221;? - Michael P. Plezbert Ron K. Cytron",0.1923500352,0.1923500352
1996,"POPL","Is it a tree, a DAG, or a cyclic graph? A shape analysis for heap-directed pointers in C - Rakesh Ghiya Laurie J. Hendren",4635.1877353248,0.1969647455
1996,"POPL","Solving shape-analysis problems in languages with destructive updating - Mooly Sagiv Thomas Reps Reinhard Wilhelm",5842.1831971782,0.2015028921
1996,"POPL","Filter fusion - Todd A. Proebsting Scott A. Watterson",2786.1879081206,0.1967919497
1996,"POPL","C: a language for high-level, efficient, and machine-independent dynamic code generation - Dawson R. Engler Wilson C. Hsieh M. Frans Kaashoek",5743.9448591326,20.4398409378
1996,"POPL","A general approach for run-time specialization and its application to C - Charles Consel Fran&#231;ois No&#235;l",3312.7740351166,776.6106649538
1996,"POPL","Discovering auxiliary information for incremental computation - Yanhong A. Liu Scott D. Stoller Tim Teitelbaum",2241.4638751501,3075.9208249202
1996,"POPL","From region inference to von Neumann machines via region representation inference - Lars Birkedal Mads Tofte Magnus Vejlstrup",1617.4279858260,3101.9567142443
1996,"POPL","A practical and flexible flow analysis for higher-order languages - J. Michael Ashley",2423.8549177881,1018.5297822822
1996,"POPL","Trace-based program analysis - Christopher Colby Peter Lee",3724.6396527260,1208.7450473444
1996,"POPL","Iterated register coalescing - Lal George Andrew W. Appel",3247.1888139620,0.1958861083
1996,"POPL","Generating machine specific optimizing compilers - Roger Hoover Kenneth Zadeck",4147.1877979809,0.1969020895
1996,"POPL","Minimum cost interprocedural register allocation - Steven M. Kurlander Charles N. Fischer",4327.1884234379,0.1962766325
1996,"POPL","Points-to analysis in almost linear time - Bjarne Steensgaard",3229.0414959923,735.3432040780
1996,"POPL","Type-directed partial evaluation - Olivier Danvy",150.1199434383,5738.2647566318
1996,"POPL","A modal analysis of staged computation - Rowan Davies Frank Pfenning",0.1978302496,4512.1868698207
1996,"POPL","Typed closure conversion - Yasuhiko Minamide Greg Morrisett Robert Harper",186.0070207666,4909.3776793037
1996,"POPL","Revisiting catamorphisms over datatypes with embedded functions (or, programs from outer space) - Leonidas Fegaras Tim Sheard",0.1969833908,4375.1877166795
1996,"POPL","Concurrent Haskell - Simon Peyton Jones Andrew Gordon Sigbjorn Finne",0.1923500352,0.1923500352
1996,"POPL","A provably time-efficient parallel implementation of full speculation - John Greiner Guy E. Blelloch",2969.1756756197,1991.2090244506
