Year,Conference,Title,Topic 0,Topic 1
1996,"POPL","Static analysis to reduce synchronization costs in data-parallel programs - Manish Gupta Edith Schonberg",4031.1881240581,0.1965760122
1996,"POPL","Functional computation as concurrent computation - Joachim Niehren",0.1968035259,3766.1878965444
1996,"POPL","Composing processes - Kohei Honda",0.1967899432,4640.1879101271
1996,"POPL","Linearity and the pi-calculus - Naoki Kobayashi Benjamin C. Pierce David N. Turner",113.3733303436,5060.0113697267
1996,"POPL","What are principal typings and what are they good for? - Trevor Jim",0.1923500352,0.1923500352
1996,"POPL","The reflexive CHAM and the join-calculus - C&#233;dric Fournet Georges Gonthier",451.3420405693,4864.0426595009
1996,"POPL","Bisimilarity for a first-order calculus of objects with subtyping - Andrew D. Gordon Gareth D. Rees",0.1961318033,3350.1885682670
1996,"POPL","An interpretation of objects and object types - Mart&#237;n Abadi Luca Cardelli Ramesh Viswanathan",485.1922878832,3374.1924121871
1996,"POPL","Proving the correctness of reactive systems using sized types - John Hughes Lars Pareto Amr Sabry",193.0404534865,5033.3442465839
1996,"POPL","Putting type annotations to work - Martin Odersky Konstantin L&#228;ufer",0.1957185066,3930.1889815638
1996,"POPL","Using parameterized signatures to express modular structure - Mark P. Jones",0.1964270399,4199.1882730304
1996,"POPL","Faster checking of software specifications by eliminating isomorphs - Daniel Jackson Somesh Jha Craig A. Damon",627.4971259414,3440.8875741289
1996,"POPL","Optimization and relaxation in constraint logic languages - Kannan Govindarajan Bharat Jayaraman Surya Mantha",688.7939821005,4839.5907179698
1996,"POPL","Pure versus impure Lisp - Nicholas Pippenger",840.1318851786,1065.2528148917
1996,"POPL","On the complexity of beta-reduction - Andrea Asperti",200.9875911406,2176.3971089297
1991,"POPL","A theory of incremental computation and its application - R. S. Sundaresh Paul Hudak",674.7793742915,3598.6053257789
1991,"POPL","Static and dynamic semantics processing - Charles Consel Olivier Danvy",2331.6141974121,1857.7705026582
1991,"POPL","The complexity of type inference for higher-order lambda calculi - Fritz Henglein Harry G. Mairson",0.1969168484,3715.1877832220
1991,"POPL","A record calculus based on symmetric concatenation - Robert Harper Benjamin Pierce",0.1959837427,3457.1887163276
1991,"POPL","Look ma, no hashing, and no arrays neither - Jiazhen Cai Robert A. Paige",3787.7139861600,458.6707139103
1991,"POPL","Macros that work - William Clinger Jonathan Rees",184.4088317695,2741.9758683008
1991,"POPL","Typing first-class continuations in ML - Bruce Duba Robert Harper David MacQueen",0.1923500352,0.1923500352
1991,"POPL","A dynamic extent control operator for partial continuations - Christian Queinnec Bernard Serpette",746.6909072950,2630.6937927754
1991,"POPL","Models of continuations without continuations - Dorai Sitaram Matthias Felleisen",56.2935572618,3194.0911428085
1991,"POPL","Parallel programming with coordination structures - Steven Lucco Oliver Sharp",3435.9545055616,300.4301945087
1991,"POPL","Coordinating first-order multiparty interactions - Yuh-Jzer Joung Scott A. Smolka",816.1561173940,2780.2285826764
1991,"POPL","Communication with directed logic variables - Alon Kleinman Yael Moscowitz Amir Pnueli Ehud Sharpio",2720.0040806395,1679.3806194308
1991,"POPL","How to make destructive updates less destructive - Martin Odersky",1558.0752946392,1507.3094054311
1991,"POPL","Parameter-passing and the lambda calculus - Erik Crank Matthias Felleisen",105.5366824503,3565.8480176200
1991,"POPL","Fully abstract translations between functional languages - Jon G. Riecke",0.1955446900,2966.1891553804
1991,"POPL","Optimal derivations in weak lambda-calculi and in orthogonal term rewriting systems - Luc Maranget",0.1953945695,4052.1893055009
1991,"POPL","An extension of standard ML modules with subtyping and inheritance - John Mitchell Sigurd Meldal Neel Madhav",371.2167770495,3697.1679230208
1991,"POPL","Static type inference in a dynamically typed language - Alex Aiken Brian Murphy",124.2487025305,2906.1359975398
1991,"POPL","Polymorphic type inference and assignment - Xavier Leroy Pierre Weis",91.3110941838,3606.0736058866
1991,"POPL","Algebraic reconstruction of types and effects - Pierre Jouvelot David Gifford",7.0784042811,2891.3062957893
1991,"POPL","Modeling concurrency with geometry - Vaughn Pratt",1343.4937173378,3412.8909827326
1991,"POPL","A logical view of composition and refinement - Martin Abadi Gordon Plotkin",29.3865062144,3072.9981938559
1991,"POPL","The semantic foundations of concurrent constraint programming - Vijay A. Saraswat Martin Rinard Prakash Panangaden",769.3811483687,7517.0035517018
1991,"POPL","On the power and limitation of strictness analysis based on abstract interpretation - R. C. Sekar Prateek Mishra I. V. Ramakrishnan",0.1966137040,3696.1880863663
1991,"POPL","Temporal proof methodologies for real-time systems - Tom Henzinger Zohar Manna Amir Pnueli",1162.1203854969,3034.2643145735
1991,"POPL","A relational approach to strictness analysis for higher-order polymorphic functions - Samson Abramsky Thomas P. Jensen",5.2630660251,1554.1216340452
1991,"POPL","Automatic construction of sparse data flow evaluation graphs - Jong-Deok Choi Ron Cytron Jeanne Ferrante",0.1923500352,0.1923500352
1991,"POPL","Dependence flow graphs: an algebraic approach to program dependencies - Keshav Pingali Micah Beck Richard Johnson Mayan Moudgill Paul Stodghill",4064.2488175106,375.1358825598
1991,"POPL","Program optimization and parallelization using idioms - Shlomit S. Pinter Ron Y. Pinter",3492.1480431541,355.2366569162
1991,"POPL","Pointer-induced aliasing: a problem classification - William Landi Barbara G. Ryder",2847.1879331479,0.1967669224
1991,"POPL","Subtyping recursive types - Roberto M. Amadio Luca Cardelli",0.1923500352,0.1923500352
1990,"POPL","On laziness and optimality in lambda interpreters: tools for specification and analysis - John Field",0.1923500352,0.1923500352
1990,"POPL","An algorithm for optimal lambda calculus reduction - John Lamping",0.1923500352,0.1923500352
1990,"POPL","A type system for Smalltalk - Justin O. Graver Ralph E. Johnson",0.1923500352,0.1923500352
1990,"POPL","A relationship between abstract interpretation and projection analysis - Geoffrey Burn",0.1923500352,0.1923500352
1990,"POPL","On determining lifetime and aliasing of dynamically allocated data in higher-order functional specifications - Alan Deutsch",0.1923500352,0.1923500352
1990,"POPL","Small domains spell fast strictness analysis - R. C. Sekar Shaunak Pawagi I. V. Ramarkrishnan",0.1923500352,0.1923500352
1990,"POPL","An efficient hybrid algorithm for incremental data flow analysis - Thomas J. Marlowe Barbara G. Ryder",0.1923500352,0.1923500352
1990,"POPL","A finite presentation theorem for approximating logic programs - Nevin Heintze Joxan Jaffar",0.1923500352,0.1923500352
1990,"POPL","Program transformation in the presence of errors - Alexander Aiken Edward L. Wimmers John H. Williams",0.1923500352,0.1923500352
1990,"POPL","Making asynchronous parallelism safe for the world - Guy L. Steele",0.1923500352,0.1923500352
1990,"POPL","Concurrent constraint programming - Vijay A. Saraswat Martin Rinard",0.1923500352,0.1923500352
1990,"POPL","Parallelism in logic programs - Raghu Ramakrishnan",0.1923500352,0.1923500352
1990,"POPL","Explicit substitutions - M. Abadi L. Cardelli P.-L. Curien J.-J. Levy",0.1923500352,0.1923500352
1990,"POPL","Combining generational and conservative garbage collection: framework and implementations - Alan Demers Mark Weiser Barry Hayes Hans Boehm Daniel Bobrow Scott Shenker",0.1923500352,0.1923500352
1990,"POPL","Scheduling time-critical instructions on RISC machines - Krishna Palem Barbara Simons",0.1923500352,0.1923500352
1990,"POPL","Automata-driven indexing of Prolog clauses - R. Ramesh I. V. Ramakrishnan D. S. Warren",0.1923500352,0.1923500352
1990,"POPL","Fairness and hyperfairness in multi-party interactions - Paul C. Attie Nissim Francez Orna Grumberg",0.1923500352,0.1923500352
1990,"POPL","Relating total and partial correctness interpretations of non-deterministic programs - Carl A. Gunter",0.1923500352,0.1923500352
1990,"POPL","On oraclizable networks and Kahn's principle - James R. Russell",0.1923500352,0.1923500352
1990,"POPL","On the relations computable by a class of concurrent automata - Eugene W. Stark",0.1923500352,0.1923500352
1990,"POPL","Higher-order modules and the phase distinction - Robert Harper John C. Mitchell Eugenio Moggi",0.1923500352,0.1923500352
1990,"POPL","Safe run-time overloading - Francois Rouaix",0.1923500352,0.1923500352
1990,"POPL","Quasi-static typing - Satish Thatte",0.1923500352,0.1923500352
1990,"POPL","A formulae-as-type notion of control - Timothy G. Griffin",0.1923500352,0.1923500352
1990,"POPL","Deciding ML typability is complete for deterministic exponential time - Harry G. Mairson",0.1923500352,0.1923500352
1990,"POPL","Implicative formulae in the proofs of computations' analogy - Andrea Asperti Gian Luigi Ferrari Roberto Gorrieri",0.1923500352,0.1923500352
1990,"POPL","Computable process - Yiannis N. Moschovakis",0.1923500352,0.1923500352
1990,"POPL","The chemical abstract machine - Gerard Berry Gerard Boudol",0.1923500352,0.1923500352
1990,"POPL","Interaction nets - Yves Lafont",0.1923500352,0.1923500352
1990,"POPL","Toward a typed foundation for method specialization and inheritance - John C. Mitchell",0.1923500352,0.1923500352
1990,"POPL","Inheritance is not subtyping - William R. Cook Walter Hill Peter S. Canning",0.1923500352,0.1923500352
1993,"POPL","Computer architectures and programming models for scalable parallel computing (abstract) - Marc Snir",355.1887078055,0.1959922648
1993,"POPL","Array-data flow analysis and its use in array privatization - Dror E. Maydan Saman P. Amarasinghe Monica S. Lam",4722.1882730691,0.1964270012
1993,"POPL","Separating stages in the continuation-passing style transformation - Julia L. Lawall Olivier Danvy",55.7034454116,3804.6812546588
1993,"POPL","Specifying the correctness of binding-time analysis - Mitchell Wand",26.9001270477,2216.4845730226
1993,"POPL","A natural semantics for lazy evaluation - John Launchbury",0.1923500352,0.1923500352
1993,"POPL","An introduction to logical relations and parametric polymorphism (abstract) - John C. Reynolds",0.1985399382,328.1861601322
1993,"POPL","Formal parametric polymorphism - Mart&#237;n Abadi Luca Cardelli Pierre-Louis Curien",0.1954171706,2908.1892828998
1993,"POPL","Relational parametricity and local variables - P. W. O'Hearn R. D. Tennent",0.1923500352,0.1923500352
1993,"POPL","Algebraic reasoning and completeness in typed languages - Jon G. Riecke Ramesh Subrahmanyam",1.5212886695,3013.8634114009
1993,"POPL","Graph types - Nils Klarlund Michael I. Schwartzbach",1269.9264783859,1590.4582216844
1993,"POPL","Explicit polymorphism and CPS conversion - Robert Harper Mark Lillibridge",0.1923500352,0.1923500352
1993,"POPL","Polymorphism by name for references and continuations - Xavier Leroy",140.7944200718,3770.5902799985
1993,"POPL","Automatic array alignment in data-parallel programs - Siddhartha Chatterjee John R. Gilbert Robert Schreiber Shang-Hua Teng",4437.4578652112,165.9268348592
1993,"POPL","Efficient flow-sensitive interprocedural computation of pointer-induced aliases and side effects - Jong-Deok Choi Michael Burke Paul Carini",5283.1885719291,0.1961281413
1993,"POPL","Automatic generation and management of interprocedural program analyses - Kwangkeun Yi Williams Ludwell Harrison",0.1923500352,0.1923500352
1993,"POPL","Static single assignment for explicitly parallel programs - Harini Srinivasan James Hook Michael Wolfe",1731.3893982337,1605.9953018367
1993,"POPL","Constructing call multigraphs using dependence graphs - Arun Lakhotia",2936.1873874122,0.1973126582
1993,"POPL","Safe type checking in a statically-typed object-oriented programming language - Kim B. Bruce",310.9860662569,4638.3986338134
1993,"POPL","Object-oriented programming without recursive types - Benjamin C. Pierce David N. Turner",0.1923500352,0.1923500352
1993,"POPL","A constructive logic of multiple subtyping - Harry G. Mairson",0.1978158900,3903.1868841803
1993,"POPL","Stratified functional programs and computational complexity - Daniel Leivant",123.8441470436,3112.5405530268
1993,"POPL","The 3 R's of optimizing constraint logic programs - Kimball G. Marriott Peter J. Stuckey",2617.9920605999,1135.3926394705
1993,"POPL","Layer sharing - E. Villemonte de la Clergerie",1339.0949779615,2771.2897221088
1993,"POPL","A novel framework of register allocation for software pipelining - Qi Ning Guang R. Gao",4384.1875702987,0.1971297716
1993,"POPL","Differential logic programming - A. Bossi M. Bugliesi M. Gabbrielli G. Levi M. C. Meo",62.3945483823,3708.9901516880
1993,"POPL","Evicted variables and the interaction of global register allocation and symbolic debugging - Ali-Reza Adl-Tabatabai Thomas Gross",3852.1887429671,0.1959571032
1993,"POPL","Incremental program testing using program dependence graphs - Samuel Bates Susan Horwitz",4454.5470708480,44.8376292223
1993,"POPL","Complexity of bi-directional data flow analysis - Dhananjay M. Dhamdhere Uday P. Khedker",3770.2123445228,64.1723555475
1993,"POPL","Type checking type classes - Tobias Nipkow Christian Prehofer",0.1958358420,2776.1888642284
1993,"POPL","Efficient recursive subtyping - Dexter Kozen Jens Palsberg Michael I. Schwartzbach",0.1957368474,1786.1889632230
1993,"POPL","A sort inference algorithm for the polyadic &#960;-calculus - Simon J. Gay",0.1967083796,2242.1879916907
1993,"POPL","Smartest recompilation - Zhong Shao Andrew W. Appel",62.9644202641,4922.4202798061
1993,"POPL","Compositional analysis of modular logic programs - Michael Codish Saumya K. Debray Roberto Giacobazzi",574.8541497739,3770.5305502964
1993,"POPL","Extending record typing to type parametric modules with sharing - Maria Virginia Aponte",0.1958595037,4241.1888405666
1993,"POPL","Call by name, assignment, and the lambda calculus - Martin Odersky Dan Rabin Paul Hudak",317.8357561662,3731.5489439042
1993,"POPL","Quasi-static scoping - Shinn-Der Lee Daniel P. Friedman",3815.6322882062,1251.7524118641
1993,"POPL","Tutorial notes on partial evaluation - Charles Consel Olivier Danvy",1752.2274688145,2239.1572312559
1993,"POPL","A categorized bibliography on incremental computation - G. Ramalingam Thomas Reps",1061.7447900970,2739.6399099733
1993,"POPL","On the orthogonality of assignments and procedures in Algol - Stephen Weeks Matthias Felleisen",123.3622984561,3582.0224016142
1993,"POPL","Imperative functional programming - Simon L. Peyton Jones Philip Wadler",2776.1286479375,1778.2560521329
1993,"POPL","Communicating reactive processes - G. Berry S. Ramesh R. K. Shyamasundar",0.1923500352,0.1923500352
1993,"POPL","Semantics for communication primitives in a polymorphic language - Atsushi Ohori Kazuhiko Kato",281.6132814591,4106.7714186113
1993,"POPL","A concurrent, generational garbage collector for a multithreaded implementation of ML - Damien Doligez Xavier Leroy",3401.1877704170,0.1969296534
1992,"POPL","The essence of functional programming - Philip Wadler",103.3470132243,3954.0376868460
1992,"POPL","The geometry of optimal lambda reduction - Georges Gonthier Mart&#237;n Abadi Jean-Jacques L&#233;vy",836.6394519084,2529.7452481620
1992,"POPL","A semantics for ML concurrency primitives - Dave Berry Robin Milner David N. Turner",284.6277902565,2445.7569098139
1992,"POPL","Compile-time analysis of parallel programs that share memory - Jyh-Herng Chow William Ludwell Harrison",2190.1854130112,1808.1992870592
1992,"POPL","A comprehensive study of the complexity of multiparty interaction - Yuh-Jzer Joung Scott A. Smolka",1073.2029827949,2181.1817172754
1992,"POPL","A compilation method for ML-style polymorphic record calculi - Atsushi Ohori",30.7628470128,3695.6218530575
1992,"POPL","Typing record concatenation for free - Didier R&#233;my",23.3453051817,3046.0393948887
1992,"POPL","Unboxed objects and polymorphic typing - Xavier Leroy",1322.7192098094,2595.6654902609
1992,"POPL","Principal signatures for higher-order program modules - Mads Tofte",0.1963324035,3231.1883676668
1992,"POPL","Type isomorphisms in a type-assignment framework - Robero Di Cosmo",11.9659538964,3583.4187461739
1992,"POPL","Pattern-based tree attribution - Charles Farnum",311.1718626189,4079.2128374514
1992,"POPL","Composable attribute grammars - R. Farrow T. J. Marlowe D. M. Yellin",370.7043250488,4161.6803750216
1992,"POPL","Linear continuations - Andrzej Filinski",16.9117117616,4231.4729883087
1992,"POPL","Recognizing substrings of LR(k) languages in linear time - Joseph Bates Alon Lavie",915.7004622368,2254.6842378335
1992,"POPL","Generalized dominators and post-dominators - Rajiv Gupta",3268.1887210923,0.1959789780
1992,"POPL","Generating a compiler for a lazy language by partial evaluation - Jesper J&#248;rgensen",812.8547624327,2965.5299376377
1992,"POPL","Partial evaluation of high-level imperative programming languages with applications in hard real-time systems - Vivek Nirkhe William Pugh",3798.3466511284,653.0380489420
1992,"POPL","Parametricity as subtyping - QingMing Ma",0.1955948746,3201.1891051958
1992,"POPL","Algorithmic aspects of type inference with subtypes - Patrick Lincoln John C. Mitchell",0.1965162488,4252.1881838216
1992,"POPL","Bounded quantification is undecidable - Benjamin C. Pierce",179.1308148305,3116.2538852398
1992,"POPL","PER models of subtyping, recursive types and higher-order polymorphism - Kim Bruce John C. Mitchell",0.1959963453,3906.1887037250
1992,"POPL","Observable sequentiality and full abstraction - Robert Cartwright Matthias Felleisen",373.6394870805,4547.7452129899
1992,"POPL","Model checking and abstraction - Edmund M. Clarke Orna Grumberg David E. Long",2932.5475741461,1240.8371259242
1992,"POPL","Garbage collecting the world - Bernard Lang Christian Queinnec Jos&#233; Piquer",5068.1879386777,0.1967613927
1992,"POPL","Abstract semantics for a higher-order functional language with logic variables - Radha Jagadeesan Keshav Pingali",559.8975402598,2882.4871598105
1992,"POPL","A mark-and-sweep collector C++ - Daniel R. Edelson",2894.1877523947,0.1969476756
1992,"POPL","Optimally profiling and tracing programs - Thomas Ball James R. Larus",4337.1890586976,0.1956413728
1992,"POPL","Bounded fixed point iteration - Hanne Riis Nielson Flemming Nielson",398.0843402595,1681.3003598108
1992,"POPL","Inductive definitions, semantics and abstract interpretations - Patrick Cousot Radhia Cousot",342.9153961208,3159.4693039495
1992,"POPL","Modelling Prolog control - Roberto Barbuti Michael Codish Roberto Giacobazzi Giorgio Levi",36.2516511068,2802.1330489634
1992,"POPL","Semantic foundations of Jade - Martin C. Rinard Monica S. Lam",3856.8951027716,1161.4895972988
1999,"POPL","AnnoDomini - Peter Harry Eidorff Fritz Henglein Christian Mossin Henning Niss Morten Heine S&#248;rensen Mads Tofte",1053.9605971985,4008.4241028719
1999,"POPL","Once upon a polymorphic type - Keith Wansbrough Simon Peyton Jones",322.6968688582,4968.6878312122
1999,"POPL","Relevant context inference - Ramkrishna Chatterjee Barbara G. Ryder William A. Landi",6356.1883134708,0.1963865995
1999,"POPL","A core calculus of dependency - Mart&#237;n Abadi Anindya Banerjee Nevin Heintze Jon G. Riecke",256.5331648795,4420.8515351907
1999,"POPL","Principality and decidable type inference for finite-rank intersection types - A. J. Kfoury J. B. Wells",0.1969817819,4618.1877182885
1999,"POPL","Representing layered monads - Andrzej Filinski",185.2462630684,5326.1384370018
1999,"POPL","Stochastic processes as concurrent constraint programs - Vineet Gupta Radha Jagadeesan Prakash Panangaden",2498.2831344606,3854.1015656097
1999,"POPL","Extending the scope of syntactic abstraction - Oscar Waddell R. Kent Dybvig",365.2253203773,3733.1593796931
1999,"POPL","Dependent types in practical programming - Hongwei Xi Frank Pfenning",216.2463744663,4481.1383256040
1999,"POPL","JFlow - Andrew C. Myers",5746.8192498037,750.5654502666
1999,"POPL","Optimal code selection in DAGs - M. Anton Ertl",1370.8020800946,1543.5826199757
1999,"POPL","Type-safe linking and modular assembly language - Neal Glew Greg Morrisett",0.1923500352,0.1923500352
1999,"POPL","Quasi-linear types - Naoki Kobayashi",2094.7458472505,3211.6388528198
1999,"POPL","Typed memory management in a calculus of capabilities - Karl Crary David Walker Greg Morrisett",1741.4219765933,2611.9627234770
1999,"POPL","Type-based analysis of uncaught exceptions - Fran&#231;ois Pessaux Xavier Leroy",2144.7703011589,3910.6143989115
1999,"POPL","Constraint systems for useless variable elimination - Mitchell Wand Igor Siveroni",553.5092360673,2236.8754640031
1999,"POPL","Continuous grammars - Martin Ruckert",442.4395594771,2413.9451405933
1999,"POPL","Software watermarking - Christian Collberg Clark Thomborson",0.1923500352,0.1923500352
1999,"POPL","Improvement in a lazy context - Andrew Moran David Sands",0.1967202420,4456.1879798283
1999,"POPL","A compositional account of the Java virtual machine - Phillip M. Yelland",3267.2181373746,1152.1665626958
1999,"POPL","A simple, comprehensive type system for Java bytecode subroutines - Robert O'Callahan",2413.8978011634,607.4868989069
1999,"POPL","Types for mobile ambients - Luca Cardelli Andrew D. Gordon",315.0179496908,4573.3667503795
1999,"POPL","Trust and partial typing in open systems of mobile agents - James Riely Matthew Hennessy",1682.6408785025,3400.7438215678
1999,"POPL","Parametric shape analysis via 3-valued logic - Mooly Sagiv Thomas Reps Reinhard Wilhelm",3983.7785115360,1325.6061885343
1999,"POPL","Aggregate structure identification and its application to program analysis - G. Ramalingam John Field Frank Tip",3902.7846409889,1604.6000590814
1998,"POPL","Higher-order unCurrying - John Hannan Patrick Hicks",0.1923500352,0.1923500352
1998,"POPL","Alias analysis of executable code - Saumya Debray Robert Muth Matthew Weippert",0.1923500352,0.1923500352
1998,"POPL","Putting pointer analysis to work - Rakesh Ghiya Laurie J. Hendren",0.1923500352,0.1923500352
1998,"POPL","Edge profiling versus path profiling - Thomas Ball Peter Mataga Mooly Sagiv",0.1923500352,0.1923500352
1998,"POPL","A type system for Java bytecode subroutines - Raymie Stata Mart&#237;n Abadi",0.1923500352,0.1923500352
1998,"POPL","Java<i><sub>light</sub></i> is type-safe&#8212;definitely - Tobias Nipkow David von Oheimb",0.1923500352,0.1923500352
1998,"POPL","Classes and mixins - Matthew Flatt Shriram Krishnamurthi Matthias Felleisen",0.1923500352,0.1923500352
1998,"POPL","Manufacturing cheap, resilient, and stealthy opaque constructs - Christian Collberg Clark Thomborson Douglas Low",0.1923500352,0.1923500352
1998,"POPL","From polyvariant flow information to intersection and union types - Jens Palsberg Christina Pavlopoulou",0.1923500352,0.1923500352
1998,"POPL","Inference of polymorphic and conditional strictness properties - Thomas P. Jensen",0.1923500352,0.1923500352
1998,"POPL","Fast interprocedural class analysis - Greg DeFouw David Grove Craig Chambers",0.1923500352,0.1923500352
1998,"POPL","Path-sensitive value-flow analysis - Rastisalv Bod&#237;k Sadun Anik",0.1923500352,0.1923500352
1998,"POPL","Escape analysis - Bruno Blanchet",0.1923500352,0.1923500352
1998,"POPL","Local type inference - Benjamin C. Pierce David N. Turner",0.1923500352,0.1923500352
1998,"POPL","Static typing for dynamic messages - Susumu Nishimura",0.1923500352,0.1923500352
1998,"POPL","Second-order unification and type inference for Church-style polymorphism - Aleksy Schubert",0.1923500352,0.1923500352
1998,"POPL","Dynamic typing as staged type inference - Mark Shields Tim Sheard Simon Peyton Jones",0.1923500352,0.1923500352
1998,"POPL","Parallel beta reduction is not elementary recursive - Andrea Asperti Harry G. Mairson",0.1923500352,0.1923500352
1998,"POPL","Parallelization in calculational forms - Zhenjiang Hu Masato Takeichi Wei-Ngan Chin",0.1923500352,0.1923500352
1998,"POPL","Single and loving it - Suresh Jagannathan Peter Thiemann Stephen Weeks Andrew Wright",0.1923500352,0.1923500352
1998,"POPL","Barrier inference - Alexander Aiken David Gay",0.1923500352,0.1923500352
1998,"POPL","Secure information flow in a multi-threaded imperative language - Geoffrey Smith Dennis Volpano",0.1923500352,0.1923500352
1998,"POPL","The SLam calculus - Nevin Heintze Jon G. Riecke",0.1923500352,0.1923500352
1998,"POPL","Data flow analysis is model checking of abstract interpretations - David A. Schmidt",0.1923500352,0.1923500352
1998,"POPL","A typed language for distributed mobile processes (extended abstract) - James Riely Matthew Hennessy",0.1923500352,0.1923500352
1998,"POPL","Security properties of typed applets - Xavier Leroy Fran&#231;ois Rouaix",0.1923500352,0.1923500352
1998,"POPL","Bridging the gulf - Simon Peyton Jones Mark Shields John Launchbury Andrew Tolmach",0.1923500352,0.1923500352
1998,"POPL","Correctness of monadic state - Zena M. Ariola Amr Sabry",0.1923500352,0.1923500352
1998,"POPL","A functional representation of data structures with a hole - Yasuhiko Minamide",0.1923500352,0.1923500352
1998,"POPL","From system F to typed assembly language - Greg Morrisett David Walker Karl Crary Neal Glew",0.1923500352,0.1923500352
1998,"POPL","Maximal static expansion - Denis Barthou Albert Cohen Jean-Fran&#231;ois Collard",0.1923500352,0.1923500352
1998,"POPL","Array SSA form and its use in parallelization - Kathleen Knobe Vivek Sarkar",0.1923500352,0.1923500352
2002,"POPL","The S<scp>LAM</scp> project - Thomas Ball Sriram K. Rajamani",0.1923500352,0.1923500352
2002,"POPL","Mining specifications - Glenn Ammons Rastislav Bod&#237;k James R. Larus",5881.1881598963,0.1965401740
