Year,Conference,Title,Topic 0,Topic 1
1986,"POPL","Remote attribute updating for language-based editors - Thomas W. Reps Carla Marceau Tim Teitelbaum",0.1923500352,0.1923500352
1986,"POPL","Dynamically bypassing copy rule chains in attribute grammars - Roger Hoover",0.1923500352,0.1923500352
1986,"POPL","High-quality code generation via bottom-up tree pattern matching - Philip J. Hatcher Thomas W. Christopher",0.1923500352,0.1923500352
1986,"POPL","A parallel language and its compilation to multiprocessor machines or VLSI - Marina C. Chen",0.1923500352,0.1923500352
1986,"POPL","Towards programming with knowledge expressions - Reino Kurki-Suonio",0.1923500352,0.1923500352
1986,"POPL","Limitations of synchronous communication with static process structure in languages for distributed computing - Barbara Liskov Maurice Herlihy Lucy Gilbert",0.1923500352,0.1923500352
1986,"POPL","Atomic data abstractions in a distributed collaborative editing system - Irene Greif Robert Seliger William E. Weihl",0.1923500352,0.1923500352
1986,"POPL","A really abstract concurrent model and its temporal logic - Howard Barringer Ruurd Kuiper Amir Pnueli",0.1923500352,0.1923500352
1986,"POPL","Expressing interesting properties of programs in propositional temporal logic - Pierre Wolper",0.1923500352,0.1923500352
1986,"POPL","Operational semantics of a parallel object-oriented language - Pierre America Jaco de Bakker Joost N. Kok Jan J. M. M. Rutten",0.1923500352,0.1923500352
1986,"POPL","Equational logic programming - Jia-Huai You P. A. Subrahmanyam",0.1923500352,0.1923500352
1986,"POPL","Logic and inheritance - Hassan A&#239;t-Kaci Roger Nasr",0.1923500352,0.1923500352
1986,"POPL","Global storage allocation in attribute evaluation - Takuya Katayama Hisashi Sasaki",0.1923500352,0.1923500352
1986,"POPL","Unification in many-sorted algebras as a device for incremental semantic analysis - Gregor Snelting Wolfgang Henhapl",0.1923500352,0.1923500352
1986,"POPL","Distributed data structures in Linda - Nicholas Carriero David Gelernter Jerrold Leichter",0.1923500352,0.1923500352
1986,"POPL","Para-functional programming - Paul Hudak Lauren Smith",0.1923500352,0.1923500352
1986,"POPL","Annotations for distributed programming in logic - Raghu Ramakrishnan Abraham Silberschatz",0.1923500352,0.1923500352
1986,"POPL","Representation independence and data abstraction - John C. Mitchell",0.1923500352,0.1923500352
1986,"POPL","Using dependent types to express modular structure - David B. MacQueen",0.1923500352,0.1923500352
1986,"POPL","Type is not a type - Albert R. Meyer Mark B. Reinhold",0.1923500352,0.1923500352
1986,"POPL","Data flow analysis of applicative programs using minimal function graphs - Neil D. Jones Alan Mycroft",0.1923500352,0.1923500352
1986,"POPL","A mechanically certified theorem about optimal concurrency of sorting networks - Christian Lengauer Chua-Huang Huang",0.1923500352,0.1923500352
1986,"POPL","Executable specifications with quantifiers in the FASE system - Stan Jefferson Samuel N. Kamin",0.1923500352,0.1923500352
1986,"POPL","Finding the source of type errors - Mitchell Wand",0.1923500352,0.1923500352
1986,"POPL","A maximum-flow approach to anomaly isolation in unification-based incremental type inference - Gregory F. Johnson Janet A. Walz",0.1923500352,0.1923500352
1986,"POPL","Hierarchical VLSI design systems based on attribute grammars - Larry G. Jones Janos Simon",0.1923500352,0.1923500352
1986,"POPL","Code motion of control structures in high-level languages - Ron Cytron Andy Lowry F. Kenneth Zadeck",0.1923500352,0.1923500352
1986,"POPL","Compilers and staging transformations - Ulrik J&#248;rring William L. Scherlis",0.1923500352,0.1923500352
1986,"POPL","Higher-order strictness analysis in untyped lambda calculus - Paul Hudak Jonathan Young",0.1923500352,0.1923500352
1986,"POPL","Retargetable high-level alias analysis - Deborah S. Coutant",0.1923500352,0.1923500352
1987,"POPL","Specification and verification of concurrent programs by A<inline-equation><f>&forall;</f></inline-equation>automata - Z. Manna A. Pnueli",0.1923500352,0.1923500352
1987,"POPL","Axioms for concurrent objects - M. P. Herlihy J. M. Wing",0.1923500352,0.1923500352
1987,"POPL","Strictness analysis and denotational abstract interpretation - F. Nielson",0.1923500352,0.1923500352
1987,"POPL","Compiling strictness into streams - C. V. Hall D. S. Wise",0.1923500352,0.1923500352
1987,"POPL","On strictness and its analysis - T.-M. Kuo P. Mishra",0.1923500352,0.1923500352
1987,"POPL","A logic for partially specified data structures - M. D. Moshier W. C. Rounds",0.1923500352,0.1923500352
1987,"POPL","An improvement to bottom-up tree pattern matching - D. R. Chase",0.1923500352,0.1923500352
1987,"POPL","LUSTRE: a declarative language for real-time programming - P. Caspi D. Pilaud N. Halbwachs J. A. Plaice",0.1923500352,0.1923500352
1987,"POPL","Appraising fairness in distributed languages - K. R. Apt N. Francez S. Katz",0.1923500352,0.1923500352
1987,"POPL","Concurrent transition system semantics of process networks - E. W. Stark",0.1923500352,0.1923500352
1987,"POPL","Semantics for concurrency without powerdomains - F. J. Oles",0.1923500352,0.1923500352
1987,"POPL","Full abstraction of a real-time denotational semantics for an OCCAM-like language - C. Huizing R. Gerth W. P. deRoever",0.1923500352,0.1923500352
1987,"POPL","Completeness and incompleteness of trace-based network proof systems - J. Widom D. Gries F. B. Schneider",0.1923500352,0.1923500352
1987,"POPL","Computable values can be classical - V. Breazu-Tannen A. R. Meyer",0.1923500352,0.1923500352
1987,"POPL","Skinny and fleshy failures of relative completeness - D. Leivant T. Fernando",0.1923500352,0.1923500352
1987,"POPL","Empty types in polymorphic lambda calculus - A. R. Meyer J. C. Mitchell E. Moggi R. Statman",0.1923500352,0.1923500352
1987,"POPL","Scheduling arithmetic and load operations in parallel with no spilling - D. Bernstein J. M. Jaffe M. Rodeh",0.1923500352,0.1923500352
1987,"POPL","Computation of aliases and support sets - A. Neirynck A. J. Demers",0.1923500352,0.1923500352
1987,"POPL","A realistic compiler generator based on high-level semantics: another progress report - P. Lee U. Pleban",0.1923500352,0.1923500352
1987,"POPL","Extensions for multi-module records in conventional programming languages - D. R. Cheriton M. E. Wolf",0.1923500352,0.1923500352
1987,"POPL","Views: a way for pattern matching to cohabit with data abstraction - P. Wadler",0.1923500352,0.1923500352
1987,"POPL","A calculus for assignments in higher-order languages - Mattias Felleisen D. P. Friedman",0.1923500352,0.1923500352
1987,"POPL","Semantic parallelization: a practical exercise in abstract interpretation - P. Jouvelot",0.1923500352,0.1923500352
1987,"POPL","The concurrent logic programming language CP: Definition and operational semantics - V. A. Saraswat",0.1923500352,0.1923500352
1987,"POPL","Automatic decomposition of scientific programs for parallel execution - r. Allen D. Callahan K. Kennedy",0.1923500352,0.1923500352
1987,"POPL","Macro-by-example: Deriving syntactic transformations from their specifications - E. E. Kohlbecker M. Wand",0.1923500352,0.1923500352
1987,"POPL","Binding performance at language design time - J. Cai R. Paige",0.1923500352,0.1923500352
1987,"POPL","Environments as first class objects - D. Gelernter S. Jagannathan T. London",0.1923500352,0.1923500352
1987,"POPL","Constraint logic programming - J. Jaffar J.-L. Lassez",0.1923500352,0.1923500352
1984,"POPL","Expressional loops - Richard C. Waters",4088.8608863922,433.5238136781
1984,"POPL","Grids - Harold L. Ossher",3149.9146319003,385.4700681700
1984,"POPL","Constraining-unification and the programming language unicorn - Robert G. Bandes",882.7394894413,817.6452106290
1984,"POPL","Implementation of an interpreter for abstract equations - Christoph M. Hoffmann Michael J. O`Donnell",579.8027200139,3599.5819800564
1984,"POPL","A combinator-based compiler for a functional language - Paul Hudak David Kranz",1096.9082518234,2537.4764482469
1984,"POPL","Treat - an applicative code generator - Jerald S. Schwarz Dean Rubine",1331.2416030261,414.1430970443
1984,"POPL","Inverse currying transformation on attribute grammars - Reinhard Wilhelm",65.5542229387,1710.8304771316
1984,"POPL","The global storage needs of a subcomputation - Jean-Claude Raoult Ravi Sethi",781.2800950161,1606.1046050543
1984,"POPL","A types-as-sets semantics for milner-style polymorphism - Mitchell Wand",15.2327337005,2443.1519663699
1984,"POPL","An ideal model for recursive polymorphic types - David MacQueen Gordon Plotkin Ravi Sethi",0.1959546208,2263.1887454496
1984,"POPL","Coercion and type inference - John C. Mitchell",0.1962151192,3122.1884849512
1984,"POPL","Editing by example - Robert Nix",4269.6863601972,459.6983398732
1984,"POPL","Reflection and semantics in LISP - Brian Cantwell Smith",598.6056527736,5726.7790472967
1984,"POPL","Direct implementation of compiler specifications or the pascal p-code compiler revisited - Don Milos Uwe Pleban George Loegel",651.5502109184,2101.8344891519
1984,"POPL","Paragon - Mark Sherman",3239.1878761189,0.1968239514
1984,"POPL","Applicative programming and digital design - Steven D. Johnson",676.2659926143,2013.1187074560
1984,"POPL","Pattern driven lazy reduction - P. A. Subrahmanyam J-H. You",358.2231125483,2015.1615875220
1984,"POPL","Static inference of properties of applicative programs - Prateek Mishra Robert M. Keller",205.6487249474,3070.7359751229
1984,"POPL","The semantics of local storage, or what makes the free-list free?(Preliminary Report) - Joseph Y. Halpern Albert R. Meyer B. A. Trakhtenbrot",486.2425427486,3190.1421573218
1984,"POPL","On relative completeness of programming logics - Michal Grabowski",0.1959226747,1065.1887773956
1984,"POPL","A good Hoare axiom system for an ALGOL-like language - Joseph Y. Halpern",231.0171236308,2633.3675764395
1984,"POPL","A hierarchical basis for reordering transformations - Joe Warren",3432.1884512526,0.1962488178
1984,"POPL","A less dynamic memory allocation scheme for algol-like languages - Thomas P. Murtagh",2004.1882045485,0.1964955218
1984,"POPL","Interactive proof checking - Thomas Reps Bowen Alpern",86.7044121577,3632.6802879126
1984,"POPL","Creating efficient systems for object-oriented languages - Norihisa Suzuki Minoru Terada",2763.1881083196,0.1965917507
1984,"POPL","Efficient implementation of the smalltalk-80 system - L. Peter Deutsch Allan M. Schiffman",2782.1883845532,0.1963155171
1984,"POPL","Generalized fair termination - Nissim Francez Dexter Kozen",235.9413705260,1540.4433295444
1984,"POPL","Temporal verification of carrier-sense local area network protocols - D. E. Shasha A. Pnueli W. Ewald",1117.6580742139,2944.7266258564
1984,"POPL","Efficient applicative data types - Eugene W. Myers",2704.5454221908,255.8392778796
1984,"POPL","Stop losing sleep over incomplete data type specifications - Jean Jacques Thiel",0.1971366236,1395.1875634468
1984,"POPL","Completion of a set of rules modulo a set of equations - Jean-Pierre Jouannaud Helene Kirchner",0.1967166980,2730.1879833724
1984,"POPL","Systems programming in concurrent prolog - Ehud Shapiro",4694.8638714936,421.5208285766
1985,"POPL","Embedding type structure in semantics - Mitchell Wand",0.1923500352,0.1923500352
1985,"POPL","Declaration-free type checking - Prateek Mishra Uday S. Reddy",0.1923500352,0.1923500352
1985,"POPL","A model and temporal proof system for networks of processes - Van Nguyen David Gries Susan Owicki",0.1923500352,0.1923500352
1985,"POPL","Logical and mathematical reasoning about imperative programs - Daniel Leivant",0.1923500352,0.1923500352
1985,"POPL","A meta-language and system for nonlocal incremental attribute evaluation in language-based editors - Gregory F. Johnson C. N. Fischer",0.1923500352,0.1923500352
1985,"POPL","Incremental compilation of optimized code - Lori L. Pollock Mary Lou Soffa",0.1923500352,0.1923500352
1985,"POPL","A greedy concurrent approach to incremental code generation - Ray Ford Duangkaew Sawamiphakdi",0.1923500352,0.1923500352
1985,"POPL","On linearizing parallel code - Jeanne Ferrante Mary Mace",0.1923500352,0.1923500352
1985,"POPL","Compiling path expressions into VLSI circuits - T. S. Anantharaman E. M. Clarke M. J. Foster B. Mishra",0.1923500352,0.1923500352
1985,"POPL","Constraints - Leslie Lamport Fred B. Schneider",0.1923500352,0.1923500352
1985,"POPL","High-level language facilities for low-level services - Christopher W. Fraser David R. Hanson",0.1923500352,0.1923500352
1985,"POPL","Matchmaker - Michael B. Jones Richard F. Rashid Mary R. Thompson",0.1923500352,0.1923500352
1985,"POPL","Types as intervals - Robert Cartwright",0.1923500352,0.1923500352
1985,"POPL","Smart recompilation - Walter F. Tichy Mark C. Baker",0.1923500352,0.1923500352
1985,"POPL","Constraining control - Daniel P. Friedman Christopher T. Haynes",0.1923500352,0.1923500352
1985,"POPL","Closurize and concentrate - Julian Padget John Fitch",0.1923500352,0.1923500352
1985,"POPL","Functional programing and the logical variable - Gary Lindstrom",0.1923500352,0.1923500352
1985,"POPL","Analyzing aliases of reference formal parameters - Keith D. Cooper",0.1923500352,0.1923500352
1985,"POPL","Constant propagation with conditional branches - Mark N. Wegman Frank Kenneth Zadeck",0.1923500352,0.1923500352
1985,"POPL","The aggregate update problem in functional programming systems - Paul Hudak Adrienne Bloss",0.1923500352,0.1923500352
1985,"POPL","Semantics-directed code generation - Andrew W. Appel",0.1923500352,0.1923500352
1985,"POPL","Optimal scheduling of arithmetic operations in parallel with memory access (preliminary version) - David Bernstein Ron Y. Pinter Michael Rodeh",0.1923500352,0.1923500352
1985,"POPL","Efficient tree pattern matching (extended abstract) - Alfred V. Aho Mahadevan Ganapathi",0.1923500352,0.1923500352
1985,"POPL","Abstract types have existential types - John C. Mitchell Gordon D. Plotkin",0.1923500352,0.1923500352
1985,"POPL","Principles of OBJ2 - Kokichi Futatsugi Joseph A. Goguen Jean-Pierre Jouannaud Jos&#233; Meseguer",0.1923500352,0.1923500352
1985,"POPL","Program specification and development in standard ML - Donald Sannella Andrzej Tarlecki",0.1923500352,0.1923500352
1985,"POPL","What it means for a concurrent program to satisfy a specification - Leslie Lamport",0.1923500352,0.1923500352
1985,"POPL","Modalities for model checking (extended abstract) - E. Allen Emerson Chin-Laung Lei",0.1923500352,0.1923500352
1985,"POPL","Checking that finite state concurrent programs satisfy their linear specification - Orna Lichtenstein Amir Pnueli",0.1923500352,0.1923500352
1985,"POPL","Denotational semantics and rewrite rules for FP - Joseph Y. Halpern John H. Williams Edward L. Wimmers Timothy C. Winkler",0.1923500352,0.1923500352
1982,"POPL","Termination of probabilistic concurrent programs - Sergiu Hart Micha Sharir Amir Pnueli",1285.6025629864,614.7821370839
1982,"POPL","Guardians and actions - Barbara Liskov Robert Scheifler",5750.1887765011,0.1959235693
1982,"POPL","Experience with an attribute grammar-based compiler - Rodney Farrow",1368.4885024697,2722.8961976006
1982,"POPL","Description-driven code generation using attribute grammars - Mahadevan Ganapathi Charles N. Fischer",3692.9364633534,517.4482367170
1982,"POPL","Code generation and reorganization in the presence of pipeline constraints - John L. Hennessy Thomas R. Gross",0.1923500352,0.1923500352
1982,"POPL","Eliminating redundant object code - Jack W. Davidson Christopher W. Fraser",1523.1887012971,0.1959987732
1982,"POPL","A type declaration and inference system for smalltalk - Alan H. Borning Daniel H. H. Ingalls",1901.4460463059,631.9386537644
1982,"POPL","Lithe - David Sandberg",336.9878476503,882.3968524200
1982,"POPL","Unified dialogue management in the carousel system - Erik Sandewall",3898.2590571367,639.1256429336
1982,"POPL","Maple - P. J. Voda",2054.5750038175,1671.8096962529
1982,"POPL","Optimal-time incremental semantic analysis for syntax-directed editors - Thomas Reps",0.1923500352,0.1923500352
1982,"POPL","Practical error recovery in LR parsing - Seppo Sippu Eljas Soisalon-Soininen",1169.0072898895,1361.3774101809
1982,"POPL","Specification and synthesis of communicating processes using an extended temporal logic - Pierre Wolper",0.1923500352,0.1923500352
1982,"POPL","Non-syntactic attribute flow in language based editors - Gregory F. Johnson Charles N. Fischer",850.4821943779,2853.9025056924
1982,"POPL","Building friendly parsers - Fahimeh Jalili Jean H. Gallier",663.0648382372,1291.3198618332
1982,"POPL","Principal type-schemes for functional programs - Luis Damas Robin Milner",0.1923500352,0.1923500352
1982,"POPL","On the composition of processes - V. R. Pratt",748.8607457233,2193.5239543471
1982,"POPL","A semantics-directed compiler generator - Lawrence Paulson",1402.4132241252,2726.9714759451
1982,"POPL","Semantics-directed machine architecture - Mitchell Wand",188.7077308197,1871.6769692506
1982,"POPL","Completion semantics and interpreter generation - Martin C. Henson Raymond Turner",120.6663188196,2202.7183812507
1982,"POPL","Partial evaluation as a means for inferencing data structures in an applicative language - H. Jan Komorowski",0.1923500352,0.1923500352
1982,"POPL","A logic for expressions with side-effects - Hans-J. Boehm",424.5901744652,2674.7945256051
1982,"POPL","An axiomatic treatment of exception handling - Shaula Yemini",2200.9140267809,322.4706732895
1982,"POPL","Messages as active agents - David W. Wall",2261.1872751000,0.1974249704
1982,"POPL","Semantics and correctness of a query language translation - E. Gansner J. R. Horgan C. M. R. Kintala D. J. Moore P. Surko",659.0093102571,2241.3753898133
1982,"POPL","Algorithmic program diagnosis - Ehud Y. Shapiro",2629.4452325076,856.9394675627
1982,"POPL","On effective axiomatizations of Hoare logics - Edmund M. Clarke Steven M. German Joseph Y. Halpern",34.3402268589,3876.0444732114
1982,"POPL","Modular verification of concurrent programs - Brent Hailpern Susan Owicki",0.1923500352,0.1923500352
1982,"POPL","Axiomatic definability and completeness for recursive programs - Albert R. Meyer John C. Mitchell",352.6105053511,2763.7741947192
1982,"POPL","Is the interesting part of process logic uninteresting? - R. Sherman A. Pnueli D. Harel",49.6391697027,2674.7455303676
1982,"POPL","On the expressive power of query languages for relational databases - Eric C. Cooper",35.0430874990,2000.3416125713
1982,"POPL","On the ability of structures to store and access information - Adrienne Critcher",2336.2335244124,662.1511756580
1982,"POPL","Extended naming conventions for communicating processes - Nissim Francez",684.3183592996,1298.0663407707
1982,"POPL","Unbounded speed variability in distributed communication systems - John Reif Paul Spirakis",3505.5540457389,151.8306543315
1982,"POPL","Programming aspects of VLSI - Richard J. Lipton Robert Sedgewick Jacobo Valdes",3009.2923000900,237.0923999803
1982,"POPL","A flexible approach to interprocedural data flow analysis and programs with recursive data structures - Neil D. Jones Steven S. Muchnick",0.1923500352,0.1923500352
1982,"POPL","Automatic generation of machine specific code optimizers - Robert Giegerich",1654.3842206437,150.0004794266
1982,"POPL","Optimal code for control structures - M. V. S. Ramanath Marvin Solomon",1067.7201286455,1440.6645714248
1983,"POPL","Five paradigm shifts in programming language design and their realization in Viron, a dataflow programming environment - Vaughan Pratt",1810.6742356355,2168.7104644348
1983,"POPL","Uncovering principles of novice programming - Jeffrey Bonar Elliot Soloway",972.1990601217,43.1856399486
1983,"POPL","Computer experiments with the <i>REVE</i> term rewriting system generator - Pierre Lescanne",0.1961996654,2501.1885004050
1983,"POPL","Precise typing of abstract data type specifications - Richard B. Kieburtz",0.1968427157,2439.1878573546
1983,"POPL","Automatic verification of finite state concurrent system using temporal logic specifications - E. M. Clarke E. A. Emerson A. P. Sistla",739.1216225738,1648.2630774965
1983,"POPL","Sometimes and not never revisited - E. Allen Emerson Joseph Y. Halpern",36.1052122569,3708.2794878134
1983,"POPL","How to cook a temporal proof system for your pet language - Zohar Manna Amir Pnueli",0.1923500352,0.1923500352
1983,"POPL","Structural semantics for polymorphic data types (preliminary report) - Daniel Leivant",0.1954289795,2394.1892710909
1983,"POPL","Incremental data flow analysis - Barbara G. Ryder",2402.0463157893,110.3383842810
1983,"POPL","Conversion of control dependence to data dependence - J. R. Allen Ken Kennedy Carrie Porterfield Joe Warren",4045.1866528158,0.1980472545
1983,"POPL","Loops in combinator-based compilers - Mitchell Wand",215.6948116943,1210.6898883761
1983,"POPL","Compilation of data-driven programs for synchronous execution - Janice E. Cuny Lawrence Snyder",0.1923500352,0.1923500352
1983,"POPL","Code generation for silicon - S. C. Johnson",1419.8129018414,22.5717982289
1983,"POPL","Summarizing graphs by regular expressions - Mark Wegman",2304.7904726205,597.5942274499
1983,"POPL","A program form based on data dependency in predicate regions - Jeanne Ferrante Karl J. Ottenstein",3788.1871113998,0.1975886705
1983,"POPL","Practical use of a polymorphic applicative language - Butler W. Lampson Eric E. Schmidt",5103.3189106017,1593.0657894686
1983,"POPL","On the unification of data and program abstraction in Ada - Peter Wegner",2335.0137682409,1592.3709318294
1983,"POPL","Incremental polymorphic type checking in <i>B</i> - Lambert Meertens",0.1923500352,0.1923500352
1983,"POPL","Mechanisms for compile-time enforcement of security - Robert E. Strom",2580.1302842381,96.2544158323
1983,"POPL","Abstraction mechanisms in the BETA programming language - Bent Bruun Kristensen Ole Lehrmann Madsen Birger M&#248;ller-Pedersen Kristen Nygaard",2504.5416585118,1035.8430415586
1983,"POPL","Locality in software systems - Naftaly H. Minsky",3356.7487660960,990.6359339744
1983,"POPL","Derivation of efficient DAG marking algorithms - R. J. R. Back Heikki Mannila Kari-Jouko R&#228;ih&#228;",1994.2679924391,46.1167076312
1983,"POPL","Reasoning about nonatomic operations - Leslie Lamport",0.1923500352,0.1923500352
1983,"POPL","Verifying reachability invariants of linked structures - Greg Nelson",695.4363862005,1477.9483138698
1983,"POPL","Practical program verification - John Nagle Scott Johnson",3153.1872114095,0.1974886608
1983,"POPL","Making variables abstract - Alan Demers James Donahue",244.3177509876,3968.0669490828
1983,"POPL","Transformational programming - Robert Paige",3578.9189576442,416.4657424261
1983,"POPL","Polymorphic type inference - Daniel Leivant",0.1923500352,0.1923500352
1980,"POPL","Analysis of pointer rotation - Norihisa Suzuki",2100.6340659262,249.7506341442
1980,"POPL","Data types, parameters and type checking - Alan J. Demers James E. Donahue",21.1545500666,2044.2301500037
1980,"POPL","On specifying verifiers - V. R. Pratt",640.5330402824,3097.8516597879
1980,"POPL","A case study in specifying the semantics of a programming language - Ravi Sethi",1687.9311475175,1627.4535525528
1980,"POPL","Final data type specifications - Samuel Kamin",776.5676861019,1642.8170139685
1980,"POPL","Expressiveness of the operation set of a data abstraction - Deepak Kapur Srivas Mandayam",1006.9278813896,3775.4568186808
1980,"POPL","On proving inductive properties of abstract data types - David R. Musser",0.1962425638,2794.1884575066
1980,"POPL","On the temporal analysis of fairness - Dov Gabbay Amir Pnueli Saharon Shelah Jonathan Stavi",302.6507046840,1952.7339953864
1980,"POPL","Sometime is sometimes not never - Leslie Lamport",957.9906093434,2970.3940907270
1980,"POPL","Propositional logics of programs - Rohit Parikh",30.7748573329,1815.6098427374
1980,"POPL","A dynamic logic of multiprocessing with incomplete information - John H. Reif Gary L. Peterson",415.3860946666,2495.9986054037
1980,"POPL","Axiomatic definitions of programming languages - Albert R. Meyer Joseph Y. Halpern",107.9356723621,2892.4490277082
1980,"POPL","A high-level approach to computer document formatting - Brian K. Reid",1925.0936441230,46.2910559473
1980,"POPL","Efficient algorithms for structural similarity of grammars - H. B. Hunt D. J. Rosenkrantz",0.1971843036,2007.1875157667
1980,"POPL","Theoretical and empirical studies on using program mutation to test the functional correctness of programs - Timothy A. Budd Richard A. DeMillo Richard J. Lipton Frederick G. Sayward",0.1923500352,0.1923500352
1980,"POPL","Type-completeness as a language principle - Alan Demers James Donahue",294.1777181994,1977.2069818709
1980,"POPL","An indeterminate constructor for applicative programming - Daniel P. Friedman David S. Wise",776.2250094661,539.1596906042
1980,"POPL","Formal specification as a design tool - John Guttag J. J. Horning",3736.6029413396,39.7817587308
1980,"POPL","Experience with an applicative string processing language - James H. Morris Eric Schmidt Philip Wadler",1860.4002361519,1276.9844639184
1980,"POPL","An overview of the SUMMER programming language - Paul Klint",1404.9246415397,256.4600585306
1980,"POPL","Analysis of simple programs over different sets of primitives - A. J. Kfoury",147.9254203579,889.4592797124
1980,"POPL","Synchronous schemes and their decision problems - Zohar Manna Amir Pnueli",118.1462246902,733.2384753802
1980,"POPL","Qualified data flow problems - L. Howard Holley Barry K. Rosen",3784.7363563910,592.6483436794
1980,"POPL","Interprocedural data flow analysis in the presence of pointers, procedure variables, and label variables - William E. Weihl",3801.1879565886,0.1967434817
1980,"POPL","Prime subprogram parsing of a program - Robert E. Tarjan Jacobo Valdes",956.6786544417,744.7060456287
