Year,Conference,Title,Topic 0,Topic 1
2013,"POPL","Fully abstract compilation to JavaScript - Cedric Fournet Nikhil Swamy Juan Chen Pierre-Evariste Dagand Pierre-Yves Strub Benjamin Livshits",7715.2290891223,0.2594327537
2013,"POPL","Towards fully automatic placement of security sanitizers and declassifiers - Benjamin Livshits Stephen Chong",4558.9572937860,2206.5312280900
2013,"POPL","The principles and practice of probabilistic programming - Noah D. Goodman",1086.2271326432,0.2613892328
2013,"POPL","A model-learner pattern for bayesian reasoning - Andrew D. Gordon Mihhail Aizatulin Johannes Borgstrom Guillaume Claret Thore Graepel Aditya V. Nori Sriram K. Rajamani Claudio Russo",7174.2251232216,0.2633986544
2013,"POPL","Hyperstream processing systems - Kohei Suenaga Hiroyoshi Sekine Ichiro Hasuo",5907.2184760343,0.2700458416
2013,"POPL","HALO - Dimitrios Vytiniotis Simon Peyton Jones Koen Claessen Dan Ros&#233;n",5509.2314285436,0.2570933323
2013,"POPL","Sigma* - Matko Botin&#269;an Domagoj Babi&#263;",6180.8707747828,397.6177470932
2013,"POPL","Checking NFA equivalence with bisimulations up to congruence - Filippo Bonchi Damien Pous",4478.3737051265,261.1148167495
2013,"POPL","Synthesis of biological models from mutation experiments - Ali Sinan Koksal Yewen Pu Saurabh Srivastava Rastislav Bodik Jasmin Fisher Nir Piterman",6129.5698797196,447.9186421564
2013,"POPL","Cache and I/O efficent functional algorithms - Guy E. Blelloch Robert Harber",3286.1829078718,2780.3056140042
2013,"POPL","Sub-polyhedral scheduling using (unit-)two-variable-per-inequality polyhedra - Ramakrishna Upadrasta Albert Cohen",5467.7469043474,1083.7416175287
2013,"POPL","Optimizing data structures in high-level programs - Tiark Rompf Arvind K. Sujeeth Nada Amin Kevin J. Brown Vojin Jovanovic HyoukJoong Lee Manohar Jonnalagedda Kunle Olukotun Martin Odersky",6220.0953906973,1755.3931311787
2013,"POPL","Principled parsing for indentation-sensitive languages - Michael D. Adams",1699.8129197624,3890.6756021136
2013,"POPL","The ramifications of sharing in data structures - Aquinas Hobor Jules Villard",6618.9808163879,1280.5077054880
2013,"POPL","Complete instantiation-based interpolation - Nishant Totla Thomas Wies",6090.2273906434,0.2611312324
2013,"POPL","Automatic detection of floating-point exceptions - Earl T. Barr Thanh Vo Vu Le Zhendong Su",5320.3217338648,470.1667880111
2013,"POPL","Subjective auxiliary state for coarse-grained concurrency - Ruy Ley-Wild Aleksandar Nanevski",7012.2316160041,0.2569058718
2013,"POPL","POPL 2014 Preview - Suresh Jagannathan Peter Sewell",0.2442609380,0.2442609380
2013,"POPL","On the linear ranking problem for integer linear-constraint loops - Amir M. Ben-Amram Samir Genaim",5120.1685196048,725.3200022712
2013,"POPL","Advanced automata minimization - Richard Mayr Lorenzo Clemente",6302.3408245432,104.1476973328
2013,"POPL","Automating relatively complete verification of higher-order functional programs - Hiroshi Unno Tachio Terauchi Naoki Kobayashi",5658.2305883293,0.2579335466
2013,"POPL","Abstraction and invariance for algebraically indexed types - Robert Atkey Patricia Johann Andrew Kennedy",6844.2231128980,0.2654089779
2013,"POPL","Static and dynamic semantics of NoSQL languages - V&#233;ronique Benzaken Giuseppe Castagna Kim Nguyen J&#233;r&#244;me Sim&#233;on",7102.3612558616,104.1272660143
2012,"POPL","Presentation of the SIGPLAN distinguished achievement award to Sir Charles Antony Richard Hoare, FRS, FREng, FBCS; and interview - Andrew P. Black Peter W. O'Hearn",225.6486270184,113.8398948576
2012,"POPL","Message of thanks - Tony Hoare",1157.2196057730,93.2689161029
2012,"POPL","Access permission contracts for scripting languages - Phillip Heidegger Annette Bieniusa Peter Thiemann",6129.6175187343,9.8710031416
2012,"POPL","Recursive proofs for inductive tree data-structures - Parthasarathy Madhusudan Xiaokang Qiu Andrei Stefanescu",6579.4734238210,334.0150980549
2012,"POPL","Symbolic finite state transducers - Margus Veanes Pieter Hooimeijer Benjamin Livshits David Molnar Nikolaj Bjorner",5393.9713966971,159.5171251789
2012,"POPL","Constraints as control - Ali Sinan K&#246;ksal Viktor Kuncak Philippe Suter",7115.2223254986,0.2661963774
2012,"POPL","Multiple facets for dynamic information flow - Thomas H. Austin Cormac Flanagan",5687.2283639047,0.2601579711
2012,"POPL","Defining code-injection attacks - Donald Ray Jay Ligatti",5235.8867521920,1151.6017696840
2012,"POPL","Deciding choreography realizability - Samik Basu Tevfik Bultan Meriem Ouederni",5077.2251633982,0.2633584778
2012,"POPL","Analysis of recursively parallel programs - Ahmed Bouajjani Michael Emmi",5436.4272132006,757.0613086753
2012,"POPL","Programming languages for programmable networks - Jennifer Rexford",239.2289986551,0.2595232209
2012,"POPL","A compiler and run-time system for network programming languages - Christopher Monsanto Nate Foster Rob Harrison David Walker",7141.2238803744,0.2646415015
2012,"POPL","Freefinement - Stephan van Staden Cristiano Calcagno Bertrand Meyer",4086.2339505260,0.2545713500
2012,"POPL","Nested refinements - Ravi Chugh Patrick M. Rondon Ranjit Jhala",6357.2315778580,0.2569440180
2012,"POPL","An abstract interpretation framework for termination - Patrick Cousot Radhia Cousot",5493.2251018909,0.2634199850
2012,"POPL","Playing in the grey area of proofs - Krystof Hoder Laura Kovacs Andrei Voronkov",4869.7657107779,619.7228110980
2012,"POPL","Static and user-extensible proof checking - Antonis Stampoulis Zhong Shao",6008.2272826657,0.2612392104
2012,"POPL","Run your research - Casey Klein John Clements Christos Dimoulas Carl Eastlund Matthias Felleisen Matthew Flatt Jay A. McCarthy Jon Rafkind Sam Tobin-Hochstadt Robert Bruce Findler",5623.5011948597,361.9873270164
2012,"POPL","Verification of parameterized concurrent programs by modular reasoning about data and control - Azadeh Farzan Zachary Kincaid",5439.6987753090,260.7897465670
2012,"POPL","Resource-sensitive synchronization inference by abduction - Matko Botincan Mike Dodds Suresh Jagannathan",6517.7957587032,23.6927631728
2012,"POPL","Syntactic control of interference for separation logic - Uday S. Reddy John C. Reynolds",6070.9124261959,33.5760956801
2012,"POPL","Canonicity for 2-dimensional type theory - Daniel R. Licata Robert Harper",5410.2310503890,0.2574714870
2012,"POPL","Algebraic foundations for effect-dependent optimisations - Ohad Kammar Gordon D. Plotkin",5424.2314060300,0.2571158460
2012,"POPL","Underspecified harnesses and interleaved bugs - Saurabh Joshi Shuvendu K. Lahiri Akash Lal",5180.2284532340,0.2600686419
2012,"POPL","On the power of coercion abstraction - Julien Cretin Didier R&#233;my",5645.2335308803,0.2549909957
2012,"POPL","Abstractions from tests - Mayur Naik Hongseok Yang Ghila Castelnuovo Mooly Sagiv",6136.2208633465,0.2676585294
2012,"POPL","Sound predictive race detection in polynomial time - Yannis Smaragdakis Jacob Evans Caitlin Sadowski Jaeheon Yi Cormac Flanagan",6241.2307487981,0.2577730778
2012,"POPL","Towards nominal computation - Mikolaj Bojanczyk Laurent Braud Bartek Klin Slawomir Lasota",5290.2207714771,0.2677503989
2012,"POPL","Programming with binders and indexed data-types - Andrew Cave Brigitte Pientka",5786.2328152721,0.2557066039
2012,"POPL","Meta-level features in an industrial-strength theorem prover - J. Strother Moore",261.3857238380,192.1027980380
2012,"POPL","Formalizing the LLVM intermediate representation for verified program transformations - Jianzhou Zhao Santosh Nagarakatte Milo M.K. Martin Steve Zdancewic",6753.3977956744,394.0907262015
2012,"POPL","Randomized accuracy-aware program transformations for efficient approximate computations - Zeyuan Allen Zhu Sasa Misailovic Jonathan A. Kelner Martin Rinard",4921.3105809568,2031.1779409191
2012,"POPL","A rely-guarantee-based simulation for verifying concurrent program transformations - Hongjin Liang Xinyu Feng Ming Fu",6324.5371886828,196.9513331932
2012,"POPL","A unified approach to fully lazy sharing - Thibaut Balabonski",5500.4911553732,9.9973665027
2012,"POPL","Towards a program logic for JavaScript - Philippa Anne Gardner Sergio Maffeis Gareth David Smith",6536.2252865839,0.2632352920
2012,"POPL","The ins and outs of gradual type inference - Aseem Rastogi Avik Chaudhuri Basil Hosmer",6729.2253158003,0.2632060756
2012,"POPL","Edit lenses - Martin Hofmann Benjamin Pierce Daniel Wagner",6070.3354727668,80.1530491091
2012,"POPL","Clarifying and compiling C/C++ concurrency - Mark Batty Kayvan Memarian Scott Owens Susmit Sarkar Peter Sewell",6620.2259168695,0.2626050064
2012,"POPL","A mechanized semantics for C++ object construction and destruction, with applications to resource management - Tahina Ramananandro Gabriel Dos Reis Xavier Leroy",5818.2209082577,0.2676136183
2012,"POPL","An executable formal semantics of C with applications - Chucky Ellison Grigore Rosu",5586.9404938891,540.5480279869
2012,"POPL","A type theory for probability density functions - Sooraj Bhat Ashish Agarwal Richard Vuduc Alexander Gray",5909.2262492267,0.2622726492
2012,"POPL","A type system for borrowing permissions - Karl Naden Robert Bocchino Jonathan Aldrich Kevin Bierhoff",6270.2279655894,0.2605562867
2012,"POPL","Self-certification - Pierre-Yves Strub Nikhil Swamy Cedric Fournet Juan Chen",7540.2304950523,0.2580268237
2012,"POPL","Higher-order functional reactive programming in bounded space - Neelakantan R. Krishnaswami Nick Benton Jan Hoffmann",5695.2225122128,0.2660096631
2012,"POPL","The marriage of bisimulations and Kripke logical relations - Chung-Kil Hur Derek Dreyer Georg Neis Viktor Vafeiadis",6563.2335335223,0.2549883537
2012,"POPL","Information effects - Roshan P. James Amr Sabry",4413.2247496380,0.2637722380
2012,"POPL","A language for automatically enforcing privacy policies - Jean Yang Kuat Yessenov Armando Solar-Lezama",5892.2273071035,0.2612147724
2012,"POPL","Probabilistic relational reasoning for differential privacy - Gilles Barthe Boris K&#246;pf Federico Olmedo Santiago Zanella B&#233;guelin",4924.2244011183,0.2641207577
2014,"POPL","Modular reasoning about concurrent higher-order imperative programs - Lars Birkedal",456.2334602228,0.2550616532
2014,"POPL","A galois connection calculus for abstract interpretation - Patrick` Cousot Radhia Cousot",1138.2300482904,0.2584735856
2014,"POPL","NetKAT - Carolyn Jane Anderson Nate Foster Arjun Guha Jean-Baptiste Jeannin Dexter Kozen Cole Schlesinger David Walker",6348.2238602546,0.2646616212
2014,"POPL","Bias-variance tradeoffs in program analysis - Rahul Sharma Aditya V. Nori Alex Aiken",5447.7948570449,147.6936648311
2014,"POPL","Abstract satisfaction - Vijay D'Silva Leopold Haller Daniel Kroening",5970.2263626417,0.2621592342
2014,"POPL","Proofs that count - Azadeh Farzan Zachary Kincaid Andreas Podelski",6309.3952633552,123.0932585208
2014,"POPL","A verified information-flow architecture - Arthur Azevedo de Amorim Nathan Collins Andr&#233; DeHon Delphine Demange C&#259;t&#259;lin Hri&#355;cu David Pichardie Benjamin C. Pierce Randy Pollack Andrew Tolmach",7339.4276556966,1008.0608661794
2014,"POPL","CakeML - Ramana Kumar Magnus O. Myreen Michael Norrish Scott Owens",6571.2880687152,854.2004531607
2014,"POPL","Probabilistic relational verification for cryptographic implementations - Gilles Barthe C&#233;dric Fournet Benjamin Gr&#233;goire Pierre-Yves Strub Nikhil Swamy Santiago Zanella-B&#233;guelin",7358.2242010820,0.2643207940
2014,"POPL","Bridging boolean and quantitative synthesis using smoothed proof search - Swarat Chaudhuri Martin Clochard Armando Solar-Lezama",5519.3727653468,134.1157565293
2014,"POPL","A constraint-based approach to solving games on infinite graphs - Tewodros Beyene Swarat Chaudhuri Corneliu Popeea Andrey Rybalchenko",6109.2247565683,0.2637653076
2014,"POPL","Sound compilation of reals - Eva Darulova Viktor Kuncak",6524.1502644297,151.3382574463
2014,"POPL","Polymorphic functions with set-theoretic types - Giuseppe Castagna Kim Nguyen Zhiwu Xu Hyeonseung Im Sergue&#239; Lenglet Luca Padovani",6692.6338356984,206.8546861776
2014,"POPL","30 years of research and development around Coq - G&#233;rard Huet Hugo Herbelin",269.2273494751,0.2611724009
2014,"POPL","The essence of Reynolds - Stephen Brookes Peter W. O'Hearn Uday Reddy",2336.8148868043,400.6736350716
2014,"POPL","Freeze after writing - Lindsey Kuper Aaron Turon Neelakantan R. Krishnaswami Ryan R. Newton",7027.5490513213,288.9394705546
2014,"POPL","Replicated data types - Sebastian Burckhardt Alexey Gotsman Hongseok Yang Marek Zawirski",7657.2256373885,0.2628844874
2014,"POPL","Verifying eventual consistency of optimistic replication systems - Ahmed Bouajjani Constantin Enea Jad Hamza",6581.2276493745,0.2608725015
2014,"POPL","On coinductive equivalences for higher-order probabilistic functional programs - Ugo Dal Lago Davide Sangiorgi Michele Alberti",5501.2308909434,0.2576309326
2014,"POPL","Probabilistic coherence spaces are fully abstract for probabilistic PCF - Thomas Ehrhard Christine Tasson Michele Pagani",4744.2289918900,0.2595299859
2014,"POPL","Tabular - Andrew D. Gordon Thore Graepel Nicolas Rolland Claudio Russo Johannes Borgstrom John Guiver",6725.7462386997,90.7422831763
2014,"POPL","Modular, higher-order cardinality analysis in theory and practice - Ilya Sergey Dimitrios Vytiniotis Simon Peyton Jones",5043.0747146038,41.4138072722
2014,"POPL","Profiling for laziness - Stephen Chang Matthias Felleisen",5140.4134081536,662.0751137224
2014,"POPL","Backpack - Scott Kilpatrick Derek Dreyer Simon Peyton Jones Simon Marlow",7246.2314961951,0.2570256808
2014,"POPL","Fair reactive programming - Andrew Cave Francisco Ferreira Prakash Panangaden Brigitte Pientka",5330.2259006888,0.2626211871
2014,"POPL","Optimal dynamic partial order reduction - Parosh Abdulla Stavros Aronis Bengt Jonsson Konstantinos Sagonas",5496.7881565307,571.7003653453
2014,"POPL","Modular reasoning about heap paths via effectively propositional formulas - Shachar Itzhaky Anindya Banerjee Neil Immerman Ori Lahav Aleksandar Nanevski Mooly Sagiv",4543.0455156289,625.4430062471
2014,"POPL","A sound and complete abstraction for reasoning about parallel prefix sums - Nathan Chong Alastair F. Donaldson Jeroen Ketema",6441.1825782911,49.3059435848
2014,"POPL","Authenticated data structures, generically - Andrew Miller Michael Hicks Jonathan Katz Elaine Shi",6381.7851519085,528.7033699675
2014,"POPL","Gradual typing embedded securely in JavaScript - Nikhil Swamy Cedric Fournet Aseem Rastogi Karthikeyan Bhargavan Juan Chen Pierre-Yves Strub Gavin Bierman",7836.2291672048,0.2593546712
2014,"POPL","Sound input filter generation for integer overflow errors - Fan Long Stelios Sidiroglou-Douskos Deokhwan Kim Martin Rinard",7206.8552869057,716.6332349702
2014,"POPL","Parametric completeness for separation theories - James Brotherston Jules Villard",4626.2332913703,0.2552305057
2014,"POPL","Proof search for propositional abstract separation logics via labelled sequents - Zh&#233; H&#243;u Ranald Clouston Rajeev Gor&#233; Alwen Tiu",4633.2319833303,0.2565385457
2014,"POPL","A proof system for separation logic with magic wand - Wonyeol Lee Sungwoo Park",5560.2249226318,0.2635992442
2014,"POPL","Combining proofs and programs in a dependently typed language - Chris Casinghino Vilhelm Sj&#246;berg Stephanie Weirich",5606.2292096204,0.2593122556
2014,"POPL","From parametricity to conservation laws, via Noether's theorem - Robert Atkey",4862.6000488755,135.8884730006
2014,"POPL","A relationally parametric model of dependent type theory - Robert Atkey Neil Ghani Patricia Johann",6404.2180338840,0.2704879919
2014,"POPL","Game semantics for interface middleweight Java - Andrzej S. Murawski Nikos Tzevelekos",4662.2276992691,0.2608226069
2014,"POPL","Abstract acceleration of general linear loops - Bertrand Jeannet Peter Schrammel Sriram Sankaranarayanan",4048.0988621631,828.3896597129
2014,"POPL","Minimization of symbolic automata - Loris D'Antoni Margus Veanes",5003.9686250748,982.5198968012
2014,"POPL","Consistency analysis of decision-making programs - Swarat Chaudhuri Azadeh Farzan Zachary Kincaid",5558.3350184783,420.1535033976
2014,"POPL","Toward general diagnosis of static errors - Danfeng Zhang Andrew C. Myers",5464.7451893466,1047.7433325294
2014,"POPL","Counter-factual typing for debugging type errors - Sheng Chen Martin Erwig",5918.9710145928,57.5175072831
2014,"POPL","Battery transition systems - Udi Boker Thomas A. Henzinger Arjun Radhakrishna",4956.6575824706,715.8309394054
2014,"POPL","Symbolic optimization with SMT solvers - Yi Li Aws Albarghouthi Zachary Kincaid Arie Gurfinkel Marsha Chechik",6081.9466642517,215.5418576243
2014,"POPL","Tracing compilation by abstract interpretation - Stefano Dissegna Francesco Logozzo Francesco Ranzato",5319.4646100627,126.0239118133
2014,"POPL","Abstract effects and proof-relevant logical relations - Nick Benton Martin Hofmann Vivek Nigam",5999.2256770992,0.2628447768
2014,"POPL","Parametric effect monads and semantics of effect systems - Shin-ya Katsumata",5619.2301529123,0.2583689636
2014,"POPL","Applying quantitative semantics to higher-order quantum computing - Michele Pagani Peter Selinger Beno&#238;t Valiron",5181.2240532372,0.2644686388
2014,"POPL","A nonstandard standardization theorem - Beniamino Accattoli Eduardo Bonelli Delia Kesner Carlos Lombardi",5921.2260498302,0.2624720458
2014,"POPL","Closed type families with overlapping equations - Richard A. Eisenberg Dimitrios Vytiniotis Simon Peyton Jones Stephanie Weirich",6286.2307335583,0.2577883176
2014,"POPL","A type-directed abstraction refinement approach to higher-order model checking - Steven J. Ramsay Robin P. Neatherway C.-H. Luke Ong",5229.5014321245,616.9870897514
2014,"POPL","Fissile type analysis - Devin Coughlin Bor-Yuh Evan Chang",7971.2239386847,0.2645831913
2014,"POPL","A trusted mechanised JavaSript specification - Martin Bodin Arthur Chargueraud Daniele Filaretti Philippa Gardner Sergio Maffeis Daiva Naudziuniene Alan Schmitt Gareth Smith",7494.9515032506,212.5370186254
2014,"POPL","An operational and axiomatic semantics for non-determinism and sequence points in C - Robbert Krebbers",5405.2216067681,0.2669151078
1977,"POPL","A complete and consistent hoare axiomatics for a simple programming language - J. Cherniavsky S. Kamin",854.4675439919,822.0209778841
1977,"POPL","Programming language constructs for which it is impossible to obtain good hoare-like axiom systems - Edmund Melson Clarke",1382.5725443608,2373.9159775152
1977,"POPL","Symbolic evaluation and the global value graph - John H. Reif Harry R. Lewis",69.2181173448,5279.2704045312
1977,"POPL","An interprocedural data flow analysis algorithm - Jeffrey M. Barth",1356.3297298635,2950.1587920124
1977,"POPL","Implementation of an array bound checker - Norihisa Suzuki Kiyoshi Ishihata",767.5770954884,2526.9114263876
1977,"POPL","The evolution of programs - Nachum Dershowitz Zohar Manna",82.1727563960,3643.3157654800
1977,"POPL","Parallel program correctness through refinement - Thomas W. Doeppner",2095.5854993505,2818.9030225254
1977,"POPL","Generalized left corner parsing - Alan J. Demers",30.1189852511,3208.3695366249
1977,"POPL","Elimination of single productions from LR parsers in conjunction with the use of default reductions - Eljas Soisalon-Soininen",30.1373096932,2799.3512121828
1977,"POPL","The competence/performance dichotomy in programming preliminary report - Vaughan R. Pratt",1024.7084425457,1747.7800793303
1977,"POPL","Structuring - Eric C. R. Hehner",482.5214899038,960.9670319721
1977,"POPL","Social processes and proofs of theorems and programs - Richard A. DeMillo Richard J. Lipton Alan J. Perlis",1060.7156008445,1615.7729210315
1977,"POPL","Code-generation for machines with multiregister operations - A. V. Aho S. C. Johnson J. D. Ullman",119.6886251529,2086.7998967231
1977,"POPL","Minimal and optimal computations of recursive programs - G&#233;rard Berry Jean-Jacques L&#233;vy",1992.2979075757,1382.1906143003
1977,"POPL","Threshold evaluation and the semantics of call by value, assignment and generic procedures - Bernard Lang",1985.5757242111,1202.9127976649
1977,"POPL","Abstract interpretation - Patrick Cousot Radhia Cousot",1233.0018574803,3196.4866643957
1977,"POPL","The equivalence problem for program schemata with nonintersecting loops - Harry R. Lewis",154.7322976806,3849.7562241954
1977,"POPL","Synchronization in actor systems - Russell Atkinson Carl Hewitt",246.9318250270,3865.5566968489
1977,"POPL","A new strategy for code generation - William Harrison",151.3373428927,2159.1511789833
1977,"POPL","Applications of high level control flow - Barry K. Rosen",732.9701393767,1966.5183824993
1977,"POPL","Generalized common subexpressions in very high level languages - Amelia C. Fong",12.2464534068,2432.2420684691
1977,"POPL","Expression continuity and the formal differentiation of algorithms - Bob Paige J. T. Schwartz",231.0338006792,2388.4547211968
1977,"POPL","Applications of a graph grammar for program control flow analysis - Ken Kennedy Linda Zucconi",60.3749225771,1975.1135992989
1977,"POPL","On the covering of left recursive grammars - A. Nijholt",4.0265147951,2302.4620070809
1977,"POPL","An efficient insertion-only error-corrector for LL(1) parsers - C. N. Fischer D. R. Milton S. B. Quiring",6.0254658028,1741.4630560732
1976,"POPL","The influence of productions on derivations and parsing (Extended Abstract) - Benton L. Leong Detlef Wotschke",128.4653017996,2048.0232200764
1976,"POPL","A complexity theory of grammar problems - H. B. Hunt",76.4074897184,1788.0810321576
1976,"POPL","An algorithm for structuring programs (Extended Abstract) - Brenda S. Baker",68.4877276285,2652.0007942474
1976,"POPL","On directly constructing LR(k) parsers without chain reductions - Wilf R. LaLonde",0.2618560837,1830.2266657923
1976,"POPL","PLAN2D - syntactic analysis of precedence graph grammars - Reinhold Franck",26.7850107503,1202.7035111257
1976,"POPL","Program improvement by source to source transformation - David B. Loveman",378.2669364282,4362.2215854478
1976,"POPL","Goal-directed program transformation - Ben Wegbreit",1098.3895433838,2911.0989784922
1976,"POPL","Primitive recursive program transformation - R. S. Boyer J. S. Moore R. E. Shostak",108.8922255444,747.5962963316
1976,"POPL","Mathematical semantics and data flow programming - Paul R. Kosinski",612.3912239568,1054.0972979192
1976,"POPL","Procedure referencing environments in SL5 - Dianne E. Britton Frederick C. Druseiks Ralph E. Griswold David R. Hanson Richard A. Holmes",369.0863349012,1553.4021869748
1976,"POPL","Verifying formal specifications of synchronous processes - Patricia P. Griffiths Charles J. Prenner",1513.3616809966,3268.1268408794
1976,"POPL","Test data as an aid in proving program correctness - Matthew Geller",388.0671204813,2937.4214013947
1976,"POPL","Code generation for expressions with common subexpressions (Extended Abstract) - A. V. Aho S. C. Johnson J. D. Ullman",72.6758891814,2846.8126326946
1976,"POPL","Automatic generation of efficient evaluators for attribute grammars - Ken Kennedy Scott K. Warren",42.3889401177,4842.0995817583
1976,"POPL","Automatic design of data processing systems - Gregory R. Ruth",859.9919311869,1786.4965906891
1976,"POPL","Techniques for the automatic selection of data structures - James Low Paul Rovner",971.1844427702,2216.3040791058
1976,"POPL","A methodology for LISP program construction from examples - Phillip D. Summers",0.2442609380,0.2442609380
1976,"POPL","Binding time optimization in programming languages - Neil D. Jones Steven S. Muchnick",1658.8133935514,3352.6751283246
1976,"POPL","A lazy evaluator - Peter Henderson James H. Morris",1177.6048319072,1317.8836899688
1976,"POPL","Induction variables in very high level languages - Amelia C. Fong Jeffrey D. Ullman",386.7570530410,1550.7314688350
1975,"POPL","Application of lattice algebra to loop optimization - Amelia Fong John Kam Jeffrey Ullman",433.4977764892,1471.9907453868
1975,"POPL","Node listings applied to data flow analysis - K. W. Kennedy",0.2442609380,0.2442609380
1975,"POPL","A description of path expressions by Petri nets - P. E. Lauer R. H. Campbell",1311.6605128058,1473.8280090702
1975,"POPL","Even simple programs are hard to analyze - Neil D. Jones Steven S. Muchnick",0.2442609380,0.2442609380
1975,"POPL","On the complexity of the circularity test for attribute grammars - M. Jazayeri W. F. Ogden W. C. Rounds",58.7169343998,2809.7715874762
1975,"POPL","On the complexity of LR(k) testing - Harry B. Hunt Thomas G. Szymanski Jeffrey D. Ullman",114.3572918612,1332.1312300148
1975,"POPL","Programming languages, natural languages, and mathematics - Peter Naur",325.0655586684,2815.4229632075
1975,"POPL","Modes, values and expressions - Marvin Solomon",785.5296963560,1762.9588255199
1975,"POPL","An assertion language for data structures - Stephen A. Cook Derek C. Oppen",0.2442609380,0.2442609380
1975,"POPL","An algebraic model for string patterns - Glenn F. Stewart",1289.4355707116,2288.0529511644
1975,"POPL","Program schemas with concurrency - Bruce P. Lester",294.4365033943,1226.0520184817
1975,"POPL","New control structures to aid gotolessness - D. M. Symes",459.8722545490,770.6162673270
1975,"POPL","A fast and usually linear algorithm for global flow analysis - Susan L. Graham Mark Wegman",232.3127553481,4019.1757665279
1975,"POPL","Structured exception handling - John B. Goodenough",1536.8249430253,5513.6635788507
1975,"POPL","An algebra of relations for machine computation - Patrick Hall Peter Hitchcock Stephen Todd",0.2442609380,0.2442609380
1975,"POPL","Computer assisted application definition - Martin Mikelsons",719.8022664172,2257.6862554588
1975,"POPL","Some optimization techniques for an extensible language - Christopher Ryland",34.1381245195,140.3503973564
