Year,Conference,Title,Topic 0,Topic 1
1975,"POPL","Automatic data structure choice in a language of very high level - J. T. Schwartz",603.7579783510,1088.7305435250
1975,"POPL","A mathematical approach to language design - George T. Ligler",2017.2694810738,1058.2190408022
1975,"POPL","Correctness-preserving program transformations - Susan L. Gerhart",0.2442609380,0.2442609380
1975,"POPL","Actor semantics of PLANNER-73 - Irene Greif Carl Hewitt",289.1912113231,3822.2973105528
1975,"POPL","Reduction - Richard J. Lipton",474.7643405631,1283.7241813129
1975,"POPL","A semantic model for parallel systems with scheduling - Ellis S. Cohen",1696.3472050702,708.1413168057
1973,"POPL","Deterministic parsing of ambiguous grammars - A. V. Aho S. C. Johnson J. D. Ullman",70.6528718161,4004.8356500599
1973,"POPL","Strict deterministic versus LR(0) parsing - Matthew M. Geller Michael A. Harrison",12.5835447851,2516.9049770909
1973,"POPL","Types are not sets - James H. Morris",832.2050440194,415.2834778566
1973,"POPL","Recursively defined data types - C. H. Lewis B. K. Rosen",0.2442609380,0.2442609380
1973,"POPL","Mode modules as representations of domains - Alice E. Fischer Michael J. Fischer",744.7089201645,686.7796017115
1973,"POPL","Advice on structuring compilers and proving them correct - F. Lockwood Morris",317.4839401355,1797.0045817405
1973,"POPL","Actor induction and meta-evaluation - Carl Hewitt Peter Bishop Irene Greif Brian Smith Todd Matson Richard Steiger",270.9329585734,2949.5555633026
1973,"POPL","Reasoning about programs - Richard J. Waldinger Karl N. Levitt",1661.8365743101,2376.6519475659
1973,"POPL","Procedure linkage optimization working paper - A. Maggiolo-Schettini B. K. Rosen H. R. Strong",0.2442609380,0.2442609380
1973,"POPL","A unified approach to global program optimization - Gary A. Kildall",153.0025326619,3960.4859892141
1973,"POPL","Analysis of a simple algorithm for global data flow problems - Matthew S. Hecht Jeffrey D. Ullman",52.7426974504,2645.7458244256
1973,"POPL","Transitions in extendible arrays - Arnold L. Rosenberg",171.5575314524,1739.9309904236
1973,"POPL","Labelled precedence parsing - Mario Schkolnick",39.5761568903,2405.9123649856
1973,"POPL","Large scale file processing - Gloria J. Lambert",201.0365437444,2831.4519781316
1973,"POPL","On the decision problems of program schemas with commutative and invertible functions - Ashok K. Chandra",139.0224792746,1867.4660426014
1973,"POPL","Top down operator precedence - Vaughan R. Pratt",680.6350696339,3175.8534522421
1973,"POPL","Practical syntactic error recovery in compilers - Susan L. Graham Steven P. Rhodes",25.7480540537,2425.7404678222
1973,"POPL","A parallel approach to compilation - Mary Zosel",168.0658885102,2899.4226333658
1973,"POPL","Programming language semantics and closed applicative languages - John Backus",0.2442609380,0.2442609380
1973,"POPL","On the definitional method of standard PL/I - David Beech",295.4168198406,1472.0717020354
1973,"POPL","Mathematical semantics of SNOBOL4 - R. D. Tennent",459.2174648363,1842.2710570397
1973,"POPL","Formalization of EXEL - L. Nolin G. Ruggiu",335.3159612578,2034.1725606181
1979,"POPL","A compact, machine-independent peephole optimizer - Christopher W. Fraser",21.5775727952,1592.9109490808
1979,"POPL","A PL/CV precis - Robert L. Constable Scott D. Johnson",902.9808476186,2270.5076742574
1979,"POPL","Universality of data retrieval languages - Alfred V. Aho Jeffrey D. Ullman",1674.1236209287,1586.3649009473
1979,"POPL","Automatic generation of near-optimal linear-time translators for non-circular attribute grammars - Rina Cohen Eli Harry",30.8674675460,4614.6210543299
1979,"POPL","Space-time tradeoffs for linear recursion - Sowmitri Swamy John E. Savage",198.2849861809,1851.2035356951
1979,"POPL","Characterization and elimination of redundancy in recursive programs - Norman H. Cohen",1350.3727523959,2837.1157694801
1979,"POPL","The functional power of parameter passage mechanism - Adrienne Critcher",1208.0989329773,2552.3895888987
1979,"POPL","An interpreter generator using tree pattern matching - Christoph M. Hoffmann Michael J. O'Donnell",515.4844189657,2464.0041029103
1979,"POPL","Specifying programming language semantics - I. Greif A. Meyer",645.1149420231,2469.3735798528
1979,"POPL","Decisions for type in APL - W. E. Gull M. A. Jenkins",0.2442609380,0.2442609380
1979,"POPL","Automatic data structure selection in SETL - Edmond Schonberg Jacob T. Schwartz Micha Sharir",1061.5353170483,2427.9532048276
1979,"POPL","Synthesis of resource invariants for concurrent programs - Edmund Melson Clarke",2361.4359325916,1243.0525892844
1979,"POPL","Inductively computable constructs in very high level languages - Amelia C. Fong",413.8487790523,1431.6397428237
1979,"POPL","String pattern matching in polynomial time - K. C. Liu A. C. Fleck",269.6594723214,1120.8290495546
1979,"POPL","Predicate path expressions - Sten Andler",1626.7838152748,1663.7047066011
1979,"POPL","Type checking in an imperfect world - Terrence C. Miller",0.2442609380,0.2442609380
1979,"POPL","Flow analysis and optimization of LISP-like structures - Neil D. Jones Steven S. Muchnick",324.0931924306,2970.3953294454
1979,"POPL","Data flow analysis of communicating processes - John H. Reif",958.5762575309,2016.9122643451
1979,"POPL","Systematic design of program analysis frameworks - Patrick Cousot Radhia Cousot",954.3413259335,4242.1471959424
1979,"POPL","Certifying information flow properties of programs - Richard P. Reitman Gregory R. Andrews",1088.7609916165,1254.7275302595
1979,"POPL","An efficient way to find the side effects of procedure calls and the aliases of variables - John P. Banning",1177.5649473960,2754.9235744799
1979,"POPL","Principles of proving concurrent programs in Gypsy - Donald I. Good Richard M. Cohen James Keeton-Williams",1686.0011271254,1718.4873947505
1979,"POPL","The evolution of list-copying algorithms and the need for structured program verification - Stanley Lee Willem P. deRoever Susan L. Gerhart",280.7194272303,4447.7690946456
1979,"POPL","First order programming logic - Robert Cartwright John McCarthy",1837.6630464410,1207.8254754349
1979,"POPL","Recursion in logics of programs - David Harel",728.1353236948,3101.3531981812
1979,"POPL","Process logic - V. R. Pratt",1748.9520864230,727.5364354530
1979,"POPL","The logic of a relational data manipulation language - Marco A. Casanova Philip A. Bernstein",851.5739352779,1841.9145865981
1978,"POPL","Compilation and delayed evaluation in APL - Leo J. Guibas Douglas K. Wyatt",238.0112356406,3128.4772862353
1978,"POPL","The Smalltalk-76 programming system design and implementation - Daniel H. H. Ingalls",537.0674655988,2556.4210562772
1978,"POPL","A portable compiler - S. C. Johnson",223.8098193347,2219.6787025413
1978,"POPL","Automating proofs of the absence of common runtime errors - Steven M. German",2887.2397267204,2879.2487951556
1978,"POPL","A Metalanguage for interactive proof in LCF - M. Gordon R. Milner L. Morris M. Newey C. Wadsworth",2486.4847060898,786.0038157862
1978,"POPL","Unrestricted procedure calls in Hoare's logic - Robert Cartwright Derek Oppen",2057.0329946842,1615.4555271917
1978,"POPL","A simplifier based on efficient decision algorithms - Greg Nelson Derek C. Oppen",1601.2239751070,1803.2645467690
1978,"POPL","Reasoning about recursively defined data structures - Derek C. Oppen",901.4114616162,1343.0770602597
1978,"POPL","Off-line and on-line algorithms for deducing equalities - Peter Downey Hanan Samet Ravi Sethi",622.4088952851,3811.0796265909
1978,"POPL","Verification and design aspects of true concurrency - David Mizell",233.5068768949,1488.9816449811
1978,"POPL","Almost control-free (indeterministic) parallel computation on permit schemes - Karel &#268;ul&#237;k",370.7262897015,1920.7622321745
1978,"POPL","Complexity of expressions allowing concurrency - W. F. Ogden W. E. Riddle W. C. Round",272.9998502307,2118.4886716453
1978,"POPL","Clauses - E. A. Ashcroft W. W. Wadge",668.3000972439,1253.1884246320
1978,"POPL","A partial evaluator, and its use for compiling iterative statements in LISP - Anders Haraldsson",217.5483307073,1875.9401911687
1978,"POPL","Nondeterminism in logics of programs - David Harel Vaughan R. Pratt",2139.5512348024,2183.9372870736
1978,"POPL","A straightforward denotational semantics for non-determinate data flow programs - Paul R. Kosinski",1547.1516268680,924.3368950080
1978,"POPL","Efficient computation of expressions with common subexpressions - Bhaskaram Prabhala Ravi Sethi",58.1050384181,2642.3834834579
1978,"POPL","A new method for compiler code generation - R. Steven Glanville Susan L. Graham",38.7119078474,3380.7766140286
1978,"POPL","A forward move algorithm for LR error recovery - Thomas J. Pennello Frank DeRemer",12.4152557993,4320.0732660766
1978,"POPL","Local constraints in the syntax and semantics of programming languages - Aravind K. Joshi Leon S. Levy Kang Yueh",297.8666125101,2464.6219093659
1978,"POPL","Data types as values - Alan Demers James Donahue Glenn Skinner",1990.2423064167,875.2462154592
1978,"POPL","Type definitions with parameters - Marvin Solomon",420.4533081852,778.0352136908
1978,"POPL","Syntactic control of interference - John C. Reynolds",1050.7862683993,1368.7022534766
1978,"POPL","Monoids for rapid data flow analysis - Barry K. Rosen",284.5545659383,4746.9339559377
1978,"POPL","A general scheme for the automatic inference of variable types - Marc A. Kaplan Jeffrey D. Ullman",584.6224491684,3756.8660727077
1978,"POPL","Symbolic program analysis in almost linear time - John H. Reif",97.7357241120,2593.7527977639
1978,"POPL","Automatic discovery of linear restraints among variables of a program - Patrick Cousot Nicolas Halbwachs",2051.0492140209,1734.4393078551
1995,"POPL","Isolating side effects in sequential languages - Jon G. Riecke Ramesh Viswanathan",4523.6276802434,335.8608416325
1995,"POPL","Sequential algorithms, deterministic parallelism, and intensional expressiveness - Stephen Brookes Denis Dancanet",2595.5500709134,1153.9384509625
1995,"POPL","Extensional polymorphism - Catherine Dubois Fran&#231;ois Rouaix Pierre Weis",4440.4184583291,625.0700635469
1995,"POPL","Compiling polymorphism using intensional type analysis - Robert Harper Greg Morrisett",4741.6957796416,524.7927422343
1995,"POPL","Applicative functors and fully transparent higher-order modules - Xavier Leroy",4572.3641941940,172.1243276819
1995,"POPL","Higher-order functors with transparent signatures - Sandip K. Biswas",2585.8298414934,525.6586803826
1995,"POPL","Structural decidable extensions of bounded quantification - Sergei G. Vorobyov",3239.4179358621,446.0705860139
1995,"POPL","Lower bounds on type inference with subtypes - My Hoang John C. Mitchell",3029.2746687368,563.2138531391
1995,"POPL","Positive subtyping - Martin Hofmann Benjamin Pierce",3807.8452816968,178.6432401791
1995,"POPL","The geometry of interaction machine - Ian Mackie",2017.0170624661,1212.4714594098
1995,"POPL","The semantics of future and its use in program optimization - Cormac Flanagan Matthias Felleisen",3200.6396380635,1112.8488838125
1995,"POPL","Total correctness by local improvement in program transformation - David Sands",3287.4495706503,1047.0389512257
1995,"POPL","Using functor categories to generate intermediate code - John C. Reynolds",2478.8913771309,1492.5971447451
1995,"POPL","A call-by-need lambda calculus - Zena M. Ariola John Maraist Martin Odersky Matthias Felleisen Philip Wadler",3033.8279994353,595.6605224407
1995,"POPL","Unification factoring for efficient execution of logic programs - S. Dawson C. R. Ramakrishnan I. V. Ramakrishnan K. Sagonas S. Skiena T. Swift D. S. Warren",1767.3001984896,2791.1883233864
1995,"POPL","Separation constraint partitioning - Klaus E. Schauser David E. Culler Seth C. Goldstein",2788.5091779605,2804.9793439155
1995,"POPL","Default timed concurrent constraint programming - Vijay A. Saraswat Radha Jagadeesan Vineet Gupta",4221.5379926370,1152.9505292390
1995,"POPL","A language with distributed scope - Luca Cardelli",3740.2708954150,824.2176264610
1995,"POPL","A formal model and specification language for procedure calling conventions - Mark W. Bailey Jack W. Davidson",728.5351617845,4716.9533600914
1995,"POPL","Obtaining sequential efficiency for concurrent object-oriented languages - John Plevyak Xingbin Zhang Andrew A. Chien",2691.1969444839,1546.2915773921
1995,"POPL","Optimizing an ANSI C interpreter with superoperators - Todd A. Proebsting",88.7936274757,3018.6948944003
1995,"POPL","Monad transformers and modular interpreters - Sheng Liang Paul Hudak Mark Jones",3759.3545858250,122.1339360510
1995,"POPL","Structuring depth-first search algorithms in Haskell - David J. King John Launchbury",1544.7350684406,2403.7534534353
1995,"POPL","Demand-driven computation of interprocedural data flow - Evelyn Duesterwald Rajiv Gupta Mary Lou Soffa",2213.8046485215,3102.6838733545
1995,"POPL","Time and space profiling for non-strict, higher-order functional languages - Patrick M. Sansom Simon L. Peyton Jones",2464.5663680987,2224.9221537773
1995,"POPL","A type system equivalent to flow analysis - Jens Palsberg Patrick O'Keefe",2264.6706915607,656.8178303152
1995,"POPL","Parametric program slicing - John Field G. Ramalingam Frank Tip",3055.0575934180,2684.4309284580
1995,"POPL","A unified treatment of flow analysis in higher-order languages - Suresh Jagannathan Stephen Weeks",2341.1604900398,1504.3280318361
1995,"POPL","Corrigendum: decidable bounded quantification - Giuseppe Castagna Benjamin C. Pierce",277.4431593584,47.0453625176
1995,"POPL","Precise interprocedural dataflow analysis via graph reachability - Thomas Reps Susan Horwitz Mooly Sagiv",2065.8878531014,2782.6006687746
1995,"POPL","A linear time algorithm for placing &#966;-nodes - Vugranam C. Sreedhar Guang R. Gao",1399.7400330838,3023.7484887922
1995,"POPL","An extended form of must alias analysis for dynamic allocation - Rita Z. Altucher William Landi",841.5053914158,3549.9831304601
1995,"POPL","Reasoning about rings - E. Allen Emerson Kedar S. Namjoshi",930.2270654960,1845.2614563800
1995,"POPL","Verifying infinite state processes with sequential and parallel composition - Ahmed Bouajjani Rachid Echahed Peter Habermehl",2845.6339555900,961.8545662860
1995,"POPL","Structured operational semantics as a specification language - Bard Bloom",2556.7560715423,1185.7324503337
1994,"POPL","Memory subsystem performance of programs using copying garbage collection - Amer Diwan David Tarditi Eliot Moss",681.3256836750,3722.1628382010
1994,"POPL","Correctness of trap-based breakpoint implementations - Norman Ramsey",1902.0361358563,979.4523860196
1994,"POPL","A type-theoretic approach to higher-order modules with sharing - Robert Harper Mark Lillibridge",4360.3220665288,447.1664553471
1994,"POPL","A type system for prototyping languages - Dinesh Katiyar David Luckham John Mitchell",4461.6447157902,669.8438060857
1994,"POPL","Decidable bounded quantification - Giuseppe Castagna Benjamin C. Pierce",3121.0065981582,170.4819237178
1994,"POPL","Soft typing with conditional types - Alexander Aiken Edward L. Wimmers T. K. Lakshman",3309.6258764845,808.8626453915
1994,"POPL","Automated synthesis of interface adapters for reusable classes - Satish R. Thatt&#233;",3961.5143195533,422.9742023227
1994,"POPL","Implementation of the typed call-by-value &#955;-calculus using a stack of regions - Mads Tofte Jean-Pierre Talpin",2610.6921949912,1081.7963268848
1994,"POPL","Deriving algorithms from type inference systems - Chris Hankin Daniel Le M&#233;tayer",2772.3816299914,555.1068918846
1994,"POPL","Formally optimal boxing - Fritz Henglein Jesper J&#248;rgensen",4679.9788675727,681.5096543032
1994,"POPL","Combinations of abstract domains for logic programming - Agostino Cortesi Baudouin Le Charlier Pascal Van Hentenryck",4238.3795507129,1022.1089711631
1994,"POPL","Analyzing logic programs with dynamic scheduling - Kim Marriott Mar&#237;a Jos&#233; Garc&#237;a de la Banda Manuel Hermenegildo",3066.6055834510,1222.8829384250
1994,"POPL","Dominators, super blocks, and program coverage - Hiralal Agrawal",460.3982889410,2584.0902329350
1994,"POPL","Higher-order equational logic programming - Zhenyu Qian",2978.8242663366,1143.6642555394
1994,"POPL","A needed narrowing strategy - Sergio Antoy Rachid Echahed Michael Hanus",3040.6463012188,945.8422206572
1994,"POPL","Detecting pipeline structural hazards quickly - Todd A. Proebsting Christopher W. Fraser",80.5983596326,1733.8901622434
1994,"POPL","An incremental algorithm for maintaining the dominator tree of a reducible flowgraph - G. Ramalingam Thomas Reps",87.4458635304,3002.0426583455
1994,"POPL","Value dependence graphs - Daniel Weise Roger F. Crew Michael Ernst Bjarne Steensgaard",2041.9500808840,3269.5384409920
1994,"POPL","Lazy array data-flow dependence analysis - Vadim Maslov",2125.0302460361,2675.4582758399
1994,"POPL","An operational framework for value-passing processes - Rance Cleaveland Daniel Yankelevich",2974.3175174667,810.1710044093
1994,"POPL","CHOCOLATE: Calculi of Higher Order COmmunication and LAmbda TErms (preliminary report) - Bard Bloom",1952.7658845770,640.7226372990
1994,"POPL","Combinatory representation of mobile processes - Kohei Honda Nobuko Yoshida",3142.1496809227,619.3388409533
1994,"POPL","Multi-pass execution of functional logic programs - Jukka Paakki",1366.2788549786,3738.2096668974
1994,"POPL","The typed polymorphic label-selective &#955;-calculus - Jacques Garrigue Hassan A&#239;t-Kaci",3383.8847576751,586.6037642009
1994,"POPL","Composing tree attributions - John Boyland Susan L. Graham",308.7323923317,4124.7561295442
1994,"POPL","A staging calculus and its application to the verification of translators (preliminary report) - Robert Muller",1606.1479024841,1052.3406193919
1994,"POPL","Reducing indirect function call overhead in C++ programs - Brad Calder Dirk Grunwald",1610.5732668223,2451.9152550537
1994,"POPL","Call forwarding - Koen De Bosschere Saumya Debray David Gudeman Sampath Kannan",0.2442609380,0.2442609380
1994,"POPL","The revival transformation - Lawrence Feigen David Klappholz Robert Casazza Xing Xue",726.3866099487,1672.1019119273
1994,"POPL","Selective and lightweight closure conversion - Mitchell Wand Paul Steckler",2171.4583381983,855.0301836776
1994,"POPL","Representing monads - Andrzej Filinski",3530.9595727263,454.5289491497
1994,"POPL","A generic account of continuation-passing styles - John Hatcliff Olivier Danvy",4572.0697843129,384.4187375631
1994,"POPL","Building interpreters by composing monads - Guy L. Steele",4989.2592500180,867.2292718579
1994,"POPL","A functional theory of local names - Martin Odersky",2992.7698808221,300.7186410539
1994,"POPL","From &#955;&#963; to &#955;&#957; - Pierre Lescanne",2190.2751508075,346.2133710685
1994,"POPL","Portable, unobtrusive garbage collection for multiprocessor systems - Damien Doligez Georges Gonthier",1029.8212936122,4321.6672282638
1994,"POPL","Higher-order concurrent programs with finite communication topology (extended abstract) - Hanne Riis Nielson Flemming Nielson",2884.2955841282,527.1929377478
1994,"POPL","Proving concurrent constraint programs correct - Frank S. de Boer Maurizio Gabbrielli Elena Marchiori Catuscia Palamidessi",2886.9464166757,452.5421052002
1994,"POPL","Manifest types, modules, and separate compilation - Xavier Leroy",5199.2736365148,270.2148853612
1997,"POPL","Fast and accurate flow-insensitive points-to analysis - Marc Shapiro Susan Horwitz",0.2442609380,0.2442609380
1997,"POPL","Partitioning dataflow analyses using types - Erik Ruf",0.2442609380,0.2442609380
1997,"POPL","Parameterized types for Java - Joseph A. Bank Andrew C. Myers Barbara Liskov",0.2442609380,0.2442609380
1997,"POPL","Pizza into Java - Martin Odersky Philip Wadler",0.2442609380,0.2442609380
1997,"POPL","Determining the idle time of a tiling - Karin H&#246;gstedt Larry Carter Jeanne Ferrante",0.2442609380,0.2442609380
1997,"POPL","Model checking for programming languages using VeriSoft - Patrice Godefroid",0.2442609380,0.2442609380
1997,"POPL","Synchronization transformations for parallel computing - Pedro Diniz Martin Rinard",0.2442609380,0.2442609380
1997,"POPL","Maximizing parallelism and minimizing synchronization with affine transforms - Amy W. Lim Monica S. Lam",0.2442609380,0.2442609380
1997,"POPL","A Curry-Howard foundation for functional computation with control - C.-H. L. Ong C. A. Stewart",0.2442609380,0.2442609380
1997,"POPL","The &#960;-calculus in direct style - G&#233;rard Boudol",0.2442609380,0.2442609380
1997,"POPL","Behavioral equivalence in the polymorphic pi-calculus - Benjamin C. Pierce Davide Sangiorgi",0.2442609380,0.2442609380
1997,"POPL","Comparing the expressive power of the synchronous and the asynchronous &#960;-calculus - Catuscia Palamidessi",0.2442609380,0.2442609380
1997,"POPL","Shape types - Pascal Fradet Daniel Le M&#233;tayer",0.2442609380,0.2442609380
1997,"POPL","Program fragments, linking, and modularization - Luca Cardelli",0.2442609380,0.2442609380
1997,"POPL","Minimal typings in atomic subtyping - Jakob Rehof",0.2442609380,0.2442609380
1997,"POPL","Typing algorithm in type theory with inheritance - Amokrane Sa&#239;bi",0.2442609380,0.2442609380
1997,"POPL","Type checking higher-order polymorphic multi-methods - Fran&#231;ois Bourdoncle Stephan Merz",0.2442609380,0.2442609380
1997,"POPL","Types as abstract interpretations - Patrick Cousot",0.2442609380,0.2442609380
1997,"POPL","Infinitary control flow analysis - Flemming Nielson Hanne Riis Nielson",0.2442609380,0.2442609380
1997,"POPL","Automatic verification of parameterized linear networks of processes - David Lesens Nicolas Halbwachs Pascal Raymond",0.2442609380,0.2442609380
1997,"POPL","On the complexity of escape analysis - Alain Deutsch",0.2442609380,0.2442609380
1997,"POPL","A demand-driven set-based analysis - Sandip K. Biswas",0.2442609380,0.2442609380
1997,"POPL","Denotational semantics using an operationally-based term model - Mitchell Wand Gregory T. Sullivan",0.2442609380,0.2442609380
1997,"POPL","Objective ML - Didier R&#233;my J&#233;r&#244;me Vouillon",0.2442609380,0.2442609380
1997,"POPL","Constraints to stop higher-order deforestation - H. Seidl M. H. S&#248;rensen",0.2442609380,0.2442609380
1997,"POPL","Reducing nondeterminism while specializing logic programs - Alberto Pettorossi Maurizio Proietti Sophie Renault",0.2442609380,0.2442609380
1997,"POPL","From SOS rules to proof principles - David Sands",0.2442609380,0.2442609380
1997,"POPL","Relational parametricity and units of measure - Andrew J. Kennedy",0.2442609380,0.2442609380
1997,"POPL","High level reading and data structure compilation - Robert Paige Zhe Yang",0.2442609380,0.2442609380
1997,"POPL","PolyP&#8212;a polytypic programming language extension - Patrik Jansson Johan Jeuring",0.2442609380,0.2442609380
1997,"POPL","First-class polymorphism with type inference - Mark P. Jones",0.2442609380,0.2442609380
1997,"POPL","Rolling your own mutable ADT&#8212;a connection between linear types and monads - Chih-Ping Chen Paul Hudak",0.2442609380,0.2442609380
1997,"POPL","Search and imperative programming - Krzysztof R. Apt Andrea Schaerf",0.2442609380,0.2442609380
1997,"POPL","A unified computation model for functional and logic programming - Michael Hanus",0.2442609380,0.2442609380
1997,"POPL","Call by need computations to root-stable form - Aart Middeldorp",0.2442609380,0.2442609380
1997,"POPL","Proof-carrying code - George C. Necula",0.2442609380,0.2442609380
1997,"POPL","Does &#8220;just in time&#8221; = &#8220;better late than never&#8221;? - Michael P. Plezbert Ron K. Cytron",0.2442609380,0.2442609380
1996,"POPL","Is it a tree, a DAG, or a cyclic graph? A shape analysis for heap-directed pointers in C - Rakesh Ghiya Laurie J. Hendren",2624.4120481603,2011.0764737157
1996,"POPL","Solving shape-analysis problems in languages with destructive updating - Mooly Sagiv Thomas Reps Reinhard Wilhelm",3309.5010217246,2532.9875001514
1996,"POPL","Filter fusion - Todd A. Proebsting Scott A. Watterson",300.3828138641,2486.1057080119
1996,"POPL","C: a language for high-level, efficient, and machine-independent dynamic code generation - Dawson R. Engler Wilson C. Hsieh M. Frans Kaashoek",1625.1877016147,4139.3008202613
1996,"POPL","A general approach for run-time specialization and its application to C - Charles Consel Fran&#231;ois No&#235;l",2372.5604617263,1716.9280601497
1996,"POPL","Discovering auxiliary information for incremental computation - Yanhong A. Liu Scott D. Stoller Tim Teitelbaum",2219.7788607790,3097.7096610970
1996,"POPL","From region inference to von Neumann machines via region representation inference - Lars Birkedal Mads Tofte Magnus Vejlstrup",3373.3585524557,1346.1299694203
1996,"POPL","A practical and flexible flow analysis for higher-order languages - J. Michael Ashley",2095.1240870588,1347.3644348171
1996,"POPL","Trace-based program analysis - Christopher Colby Peter Lee",3199.7106518392,1733.7778700367
1996,"POPL","Iterated register coalescing - Lal George Andrew W. Appel",104.1314858796,3143.3570359964
1996,"POPL","Generating machine specific optimizing compilers - Roger Hoover Kenneth Zadeck",336.0163194695,3811.4722024065
1996,"POPL","Minimum cost interprocedural register allocation - Steven M. Kurlander Charles N. Fischer",309.0990323185,4018.3894895574
1996,"POPL","Points-to analysis in almost linear time - Bjarne Steensgaard",2752.7392446293,1211.7492772467
1996,"POPL","Type-directed partial evaluation - Olivier Danvy",4945.4409667134,943.0475551626
1996,"POPL","A modal analysis of staged computation - Rowan Davies Frank Pfenning",4120.9405536161,391.5479682598
1996,"POPL","Typed closure conversion - Yasuhiko Minamide Greg Morrisett Robert Harper",4627.6723531255,467.8161687504
