Year,Conference,Title,Topic 0,Topic 1
1986,"POPL","Remote attribute updating for language-based editors - Thomas W. Reps Carla Marceau Tim Teitelbaum",0.2442609380,0.2442609380
1986,"POPL","Dynamically bypassing copy rule chains in attribute grammars - Roger Hoover",0.2442609380,0.2442609380
1986,"POPL","High-quality code generation via bottom-up tree pattern matching - Philip J. Hatcher Thomas W. Christopher",0.2442609380,0.2442609380
1986,"POPL","A parallel language and its compilation to multiprocessor machines or VLSI - Marina C. Chen",0.2442609380,0.2442609380
1986,"POPL","Towards programming with knowledge expressions - Reino Kurki-Suonio",0.2442609380,0.2442609380
1986,"POPL","Limitations of synchronous communication with static process structure in languages for distributed computing - Barbara Liskov Maurice Herlihy Lucy Gilbert",0.2442609380,0.2442609380
1986,"POPL","Atomic data abstractions in a distributed collaborative editing system - Irene Greif Robert Seliger William E. Weihl",0.2442609380,0.2442609380
1986,"POPL","A really abstract concurrent model and its temporal logic - Howard Barringer Ruurd Kuiper Amir Pnueli",0.2442609380,0.2442609380
1986,"POPL","Expressing interesting properties of programs in propositional temporal logic - Pierre Wolper",0.2442609380,0.2442609380
1986,"POPL","Operational semantics of a parallel object-oriented language - Pierre America Jaco de Bakker Joost N. Kok Jan J. M. M. Rutten",0.2442609380,0.2442609380
1986,"POPL","Equational logic programming - Jia-Huai You P. A. Subrahmanyam",0.2442609380,0.2442609380
1986,"POPL","Logic and inheritance - Hassan A&#239;t-Kaci Roger Nasr",0.2442609380,0.2442609380
1986,"POPL","Global storage allocation in attribute evaluation - Takuya Katayama Hisashi Sasaki",0.2442609380,0.2442609380
1986,"POPL","Unification in many-sorted algebras as a device for incremental semantic analysis - Gregor Snelting Wolfgang Henhapl",0.2442609380,0.2442609380
1986,"POPL","Distributed data structures in Linda - Nicholas Carriero David Gelernter Jerrold Leichter",0.2442609380,0.2442609380
1986,"POPL","Para-functional programming - Paul Hudak Lauren Smith",0.2442609380,0.2442609380
1986,"POPL","Annotations for distributed programming in logic - Raghu Ramakrishnan Abraham Silberschatz",0.2442609380,0.2442609380
1986,"POPL","Representation independence and data abstraction - John C. Mitchell",0.2442609380,0.2442609380
1986,"POPL","Using dependent types to express modular structure - David B. MacQueen",0.2442609380,0.2442609380
1986,"POPL","Type is not a type - Albert R. Meyer Mark B. Reinhold",0.2442609380,0.2442609380
1986,"POPL","Data flow analysis of applicative programs using minimal function graphs - Neil D. Jones Alan Mycroft",0.2442609380,0.2442609380
1986,"POPL","A mechanically certified theorem about optimal concurrency of sorting networks - Christian Lengauer Chua-Huang Huang",0.2442609380,0.2442609380
1986,"POPL","Executable specifications with quantifiers in the FASE system - Stan Jefferson Samuel N. Kamin",0.2442609380,0.2442609380
1986,"POPL","Finding the source of type errors - Mitchell Wand",0.2442609380,0.2442609380
1986,"POPL","A maximum-flow approach to anomaly isolation in unification-based incremental type inference - Gregory F. Johnson Janet A. Walz",0.2442609380,0.2442609380
1986,"POPL","Hierarchical VLSI design systems based on attribute grammars - Larry G. Jones Janos Simon",0.2442609380,0.2442609380
1986,"POPL","Code motion of control structures in high-level languages - Ron Cytron Andy Lowry F. Kenneth Zadeck",0.2442609380,0.2442609380
1986,"POPL","Compilers and staging transformations - Ulrik J&#248;rring William L. Scherlis",0.2442609380,0.2442609380
1986,"POPL","Higher-order strictness analysis in untyped lambda calculus - Paul Hudak Jonathan Young",0.2442609380,0.2442609380
1986,"POPL","Retargetable high-level alias analysis - Deborah S. Coutant",0.2442609380,0.2442609380
1987,"POPL","Specification and verification of concurrent programs by A<inline-equation><f>&forall;</f></inline-equation>automata - Z. Manna A. Pnueli",0.2442609380,0.2442609380
1987,"POPL","Axioms for concurrent objects - M. P. Herlihy J. M. Wing",0.2442609380,0.2442609380
1987,"POPL","Strictness analysis and denotational abstract interpretation - F. Nielson",0.2442609380,0.2442609380
1987,"POPL","Compiling strictness into streams - C. V. Hall D. S. Wise",0.2442609380,0.2442609380
1987,"POPL","On strictness and its analysis - T.-M. Kuo P. Mishra",0.2442609380,0.2442609380
1987,"POPL","A logic for partially specified data structures - M. D. Moshier W. C. Rounds",0.2442609380,0.2442609380
1987,"POPL","An improvement to bottom-up tree pattern matching - D. R. Chase",0.2442609380,0.2442609380
1987,"POPL","LUSTRE: a declarative language for real-time programming - P. Caspi D. Pilaud N. Halbwachs J. A. Plaice",0.2442609380,0.2442609380
1987,"POPL","Appraising fairness in distributed languages - K. R. Apt N. Francez S. Katz",0.2442609380,0.2442609380
1987,"POPL","Concurrent transition system semantics of process networks - E. W. Stark",0.2442609380,0.2442609380
1987,"POPL","Semantics for concurrency without powerdomains - F. J. Oles",0.2442609380,0.2442609380
1987,"POPL","Full abstraction of a real-time denotational semantics for an OCCAM-like language - C. Huizing R. Gerth W. P. deRoever",0.2442609380,0.2442609380
1987,"POPL","Completeness and incompleteness of trace-based network proof systems - J. Widom D. Gries F. B. Schneider",0.2442609380,0.2442609380
1987,"POPL","Computable values can be classical - V. Breazu-Tannen A. R. Meyer",0.2442609380,0.2442609380
1987,"POPL","Skinny and fleshy failures of relative completeness - D. Leivant T. Fernando",0.2442609380,0.2442609380
1987,"POPL","Empty types in polymorphic lambda calculus - A. R. Meyer J. C. Mitchell E. Moggi R. Statman",0.2442609380,0.2442609380
1987,"POPL","Scheduling arithmetic and load operations in parallel with no spilling - D. Bernstein J. M. Jaffe M. Rodeh",0.2442609380,0.2442609380
1987,"POPL","Computation of aliases and support sets - A. Neirynck A. J. Demers",0.2442609380,0.2442609380
1987,"POPL","A realistic compiler generator based on high-level semantics: another progress report - P. Lee U. Pleban",0.2442609380,0.2442609380
1987,"POPL","Extensions for multi-module records in conventional programming languages - D. R. Cheriton M. E. Wolf",0.2442609380,0.2442609380
1987,"POPL","Views: a way for pattern matching to cohabit with data abstraction - P. Wadler",0.2442609380,0.2442609380
1987,"POPL","A calculus for assignments in higher-order languages - Mattias Felleisen D. P. Friedman",0.2442609380,0.2442609380
1987,"POPL","Semantic parallelization: a practical exercise in abstract interpretation - P. Jouvelot",0.2442609380,0.2442609380
1987,"POPL","The concurrent logic programming language CP: Definition and operational semantics - V. A. Saraswat",0.2442609380,0.2442609380
1987,"POPL","Automatic decomposition of scientific programs for parallel execution - r. Allen D. Callahan K. Kennedy",0.2442609380,0.2442609380
1987,"POPL","Macro-by-example: Deriving syntactic transformations from their specifications - E. E. Kohlbecker M. Wand",0.2442609380,0.2442609380
1987,"POPL","Binding performance at language design time - J. Cai R. Paige",0.2442609380,0.2442609380
1987,"POPL","Environments as first class objects - D. Gelernter S. Jagannathan T. London",0.2442609380,0.2442609380
1987,"POPL","Constraint logic programming - J. Jaffar J.-L. Lassez",0.2442609380,0.2442609380
1984,"POPL","Expressional loops - Richard C. Waters",2208.2495373127,2314.2389845633
1984,"POPL","Grids - Harold L. Ossher",1567.1234573634,1968.3650645126
1984,"POPL","Constraining-unification and the programming language unicorn - Robert G. Bandes",512.4503861367,1188.0381357393
1984,"POPL","Implementation of an interpreter for abstract equations - Christoph M. Hoffmann Michael J. O`Donnell",1064.8325490017,3114.6559728743
1984,"POPL","A combinator-based compiler for a functional language - Paul Hudak David Kranz",1765.7120034514,1868.7765184246
1984,"POPL","Treat - an applicative code generator - Jerald S. Schwarz Dean Rubine",238.0789359626,1507.4095859134
1984,"POPL","Inverse currying transformation on attribute grammars - Reinhard Wilhelm",168.7081074667,1607.7804144093
1984,"POPL","The global storage needs of a subcomputation - Jean-Claude Raoult Ravi Sethi",369.4359428433,2018.0525790327
1984,"POPL","A types-as-sets semantics for milner-style polymorphism - Mitchell Wand",1938.3425112538,520.1460106222
1984,"POPL","An ideal model for recursive polymorphic types - David MacQueen Gordon Plotkin Ravi Sethi",1579.1453278046,684.3431940714
1984,"POPL","Coercion and type inference - John C. Mitchell",2620.1630132290,502.3255086470
1984,"POPL","Editing by example - Robert Nix",229.2430059016,4500.2455159744
1984,"POPL","Reflection and semantics in LISP - Brian Cantwell Smith",3774.1889079394,2551.2996139365
1984,"POPL","Direct implementation of compiler specifications or the pascal p-code compiler revisited - Don Milos Uwe Pleban George Loegel",276.5743782791,2476.9141435969
1984,"POPL","Paragon - Mark Sherman",1849.5990574004,1389.8894644756
1984,"POPL","Applicative programming and digital design - Steven D. Johnson",414.0683133005,2275.4202085755
1984,"POPL","Pattern driven lazy reduction - P. A. Subrahmanyam J-H. You",975.2841532790,1398.2043685970
1984,"POPL","Static inference of properties of applicative programs - Prateek Mishra Robert M. Keller",2279.8616744200,996.6268474560
1984,"POPL","The semantics of local storage, or what makes the free-list free?(Preliminary Report) - Joseph Y. Halpern Albert R. Meyer B. A. Trakhtenbrot",2479.6034261675,1196.8850957085
1984,"POPL","On relative completeness of programming logics - Michal Grabowski",216.4227075688,849.0658143072
1984,"POPL","A good Hoare axiom system for an ALGOL-like language - Joseph Y. Halpern",1874.6097353864,989.8787864895
1984,"POPL","A hierarchical basis for reordering transformations - Joe Warren",904.0664705644,2528.4220513116
1984,"POPL","A less dynamic memory allocation scheme for algol-like languages - Thomas P. Murtagh",67.5928623681,1936.8956595078
1984,"POPL","Interactive proof checking - Thomas Reps Bowen Alpern",596.4585339454,3123.0299879306
1984,"POPL","Creating efficient systems for object-oriented languages - Norihisa Suzuki Minoru Terada",1400.5640618545,1362.9244600215
1984,"POPL","Efficient implementation of the smalltalk-80 system - L. Peter Deutsch Allan M. Schiffman",269.9612398307,2512.5272820453
1984,"POPL","Generalized fair termination - Nissim Francez Dexter Kozen",1068.4064514617,708.0820704143
1984,"POPL","Temporal verification of carrier-sense local area network protocols - D. E. Shasha A. Pnueli W. Ewald",2801.1828502568,1261.3056716192
1984,"POPL","Efficient applicative data types - Eugene W. Myers",803.5044919628,2156.9840299131
1984,"POPL","Stop losing sleep over incomplete data type specifications - Jean Jacques Thiel",390.9766656770,1004.5118561990
1984,"POPL","Completion of a set of rules modulo a set of equations - Jean-Pierre Jouannaud Helene Kirchner",1106.4915299851,1623.9969918909
1984,"POPL","Systems programming in concurrent prolog - Ehud Shapiro",923.9844366471,4192.5040852289
1985,"POPL","Embedding type structure in semantics - Mitchell Wand",0.2442609380,0.2442609380
1985,"POPL","Declaration-free type checking - Prateek Mishra Uday S. Reddy",0.2442609380,0.2442609380
1985,"POPL","A model and temporal proof system for networks of processes - Van Nguyen David Gries Susan Owicki",0.2442609380,0.2442609380
1985,"POPL","Logical and mathematical reasoning about imperative programs - Daniel Leivant",0.2442609380,0.2442609380
1985,"POPL","A meta-language and system for nonlocal incremental attribute evaluation in language-based editors - Gregory F. Johnson C. N. Fischer",0.2442609380,0.2442609380
1985,"POPL","Incremental compilation of optimized code - Lori L. Pollock Mary Lou Soffa",0.2442609380,0.2442609380
1985,"POPL","A greedy concurrent approach to incremental code generation - Ray Ford Duangkaew Sawamiphakdi",0.2442609380,0.2442609380
1985,"POPL","On linearizing parallel code - Jeanne Ferrante Mary Mace",0.2442609380,0.2442609380
1985,"POPL","Compiling path expressions into VLSI circuits - T. S. Anantharaman E. M. Clarke M. J. Foster B. Mishra",0.2442609380,0.2442609380
1985,"POPL","Constraints - Leslie Lamport Fred B. Schneider",0.2442609380,0.2442609380
1985,"POPL","High-level language facilities for low-level services - Christopher W. Fraser David R. Hanson",0.2442609380,0.2442609380
1985,"POPL","Matchmaker - Michael B. Jones Richard F. Rashid Mary R. Thompson",0.2442609380,0.2442609380
1985,"POPL","Types as intervals - Robert Cartwright",0.2442609380,0.2442609380
1985,"POPL","Smart recompilation - Walter F. Tichy Mark C. Baker",0.2442609380,0.2442609380
1985,"POPL","Constraining control - Daniel P. Friedman Christopher T. Haynes",0.2442609380,0.2442609380
1985,"POPL","Closurize and concentrate - Julian Padget John Fitch",0.2442609380,0.2442609380
1985,"POPL","Functional programing and the logical variable - Gary Lindstrom",0.2442609380,0.2442609380
1985,"POPL","Analyzing aliases of reference formal parameters - Keith D. Cooper",0.2442609380,0.2442609380
1985,"POPL","Constant propagation with conditional branches - Mark N. Wegman Frank Kenneth Zadeck",0.2442609380,0.2442609380
1985,"POPL","The aggregate update problem in functional programming systems - Paul Hudak Adrienne Bloss",0.2442609380,0.2442609380
1985,"POPL","Semantics-directed code generation - Andrew W. Appel",0.2442609380,0.2442609380
1985,"POPL","Optimal scheduling of arithmetic operations in parallel with memory access (preliminary version) - David Bernstein Ron Y. Pinter Michael Rodeh",0.2442609380,0.2442609380
1985,"POPL","Efficient tree pattern matching (extended abstract) - Alfred V. Aho Mahadevan Ganapathi",0.2442609380,0.2442609380
1985,"POPL","Abstract types have existential types - John C. Mitchell Gordon D. Plotkin",0.2442609380,0.2442609380
1985,"POPL","Principles of OBJ2 - Kokichi Futatsugi Joseph A. Goguen Jean-Pierre Jouannaud Jos&#233; Meseguer",0.2442609380,0.2442609380
1985,"POPL","Program specification and development in standard ML - Donald Sannella Andrzej Tarlecki",0.2442609380,0.2442609380
1985,"POPL","What it means for a concurrent program to satisfy a specification - Leslie Lamport",0.2442609380,0.2442609380
1985,"POPL","Modalities for model checking (extended abstract) - E. Allen Emerson Chin-Laung Lei",0.2442609380,0.2442609380
1985,"POPL","Checking that finite state concurrent programs satisfy their linear specification - Orna Lichtenstein Amir Pnueli",0.2442609380,0.2442609380
1985,"POPL","Denotational semantics and rewrite rules for FP - Joseph Y. Halpern John H. Williams Edward L. Wimmers Timothy C. Winkler",0.2442609380,0.2442609380
1982,"POPL","Termination of probabilistic concurrent programs - Sergiu Hart Micha Sharir Amir Pnueli",913.8078738217,986.6806480543
1982,"POPL","Guardians and actions - Barbara Liskov Robert Scheifler",4316.7505326340,1433.7379892420
1982,"POPL","Experience with an attribute grammar-based compiler - Rodney Farrow",246.4439550646,3845.0445668114
1982,"POPL","Description-driven code generation using attribute grammars - Mahadevan Ganapathi Charles N. Fischer",137.3479101640,4073.1406117120
1982,"POPL","Code generation and reorganization in the presence of pipeline constraints - John L. Hennessy Thomas R. Gross",0.2442609380,0.2442609380
1982,"POPL","Eliminating redundant object code - Jack W. Davidson Christopher W. Fraser",38.1251094020,1485.3634124740
1982,"POPL","A type declaration and inference system for smalltalk - Alan H. Borning Daniel H. H. Ingalls",1793.3153184800,740.1732033959
1982,"POPL","Lithe - David Sandberg",770.9353733486,448.5531485274
1982,"POPL","Unified dialogue management in the carousel system - Erik Sandewall",2397.2392461685,2140.2492757075
1982,"POPL","Maple - P. J. Voda",2372.3308036618,1354.1577182141
1982,"POPL","Optimal-time incremental semantic analysis for syntax-directed editors - Thomas Reps",0.2442609380,0.2442609380
1982,"POPL","Practical error recovery in LR parsing - Seppo Sippu Eljas Soisalon-Soininen",72.4701600451,2458.0183618309
1982,"POPL","Specification and synthesis of communicating processes using an extended temporal logic - Pierre Wolper",0.2442609380,0.2442609380
1982,"POPL","Non-syntactic attribute flow in language based editors - Gregory F. Johnson Charles N. Fischer",170.6358404099,3533.8526814661
1982,"POPL","Building friendly parsers - Fahimeh Jalili Jean H. Gallier",2.6760678993,1951.8124539767
1982,"POPL","Principal type-schemes for functional programs - Luis Damas Robin Milner",0.2442609380,0.2442609380
1982,"POPL","On the composition of processes - V. R. Pratt",1711.8543118038,1230.6342100722
1982,"POPL","A semantics-directed compiler generator - Lawrence Paulson",461.5453252896,3667.9431965864
1982,"POPL","Semantics-directed machine architecture - Mitchell Wand",241.3495764081,1819.1389454679
1982,"POPL","Completion semantics and interpreter generation - Martin C. Henson Raymond Turner",895.1879487432,1428.3005731328
1982,"POPL","Partial evaluation as a means for inferencing data structures in an applicative language - H. Jan Komorowski",0.2442609380,0.2442609380
1982,"POPL","A logic for expressions with side-effects - Hans-J. Boehm",1188.3200029798,1911.1685188962
1982,"POPL","An axiomatic treatment of exception handling - Shaula Yemini",331.3143656076,2192.1741562683
1982,"POPL","Messages as active agents - David W. Wall",351.5152673522,1909.9732545238
1982,"POPL","Semantics and correctness of a query language translation - E. Gansner J. R. Horgan C. M. R. Kintala D. J. Moore P. Surko",533.0555253633,2367.4329965126
1982,"POPL","Algorithmic program diagnosis - Ehud Y. Shapiro",1577.0519099675,1909.4366119085
1982,"POPL","On effective axiomatizations of Hoare logics - Edmund M. Clarke Steven M. German Joseph Y. Halpern",2172.8084321220,1737.6800897540
1982,"POPL","Modular verification of concurrent programs - Brent Hailpern Susan Owicki",0.2442609380,0.2442609380
1982,"POPL","Axiomatic definability and completeness for recursive programs - Albert R. Meyer John C. Mitchell",1646.1240777056,1470.3644441704
1982,"POPL","Is the interesting part of process logic uninteresting? - R. Sherman A. Pnueli D. Harel",493.1850831428,2231.3034387332
1982,"POPL","On the expressive power of query languages for relational databases - Eric C. Cooper",1227.3200291621,808.1684927139
1982,"POPL","On the ability of structures to store and access information - Adrienne Critcher",135.9050311870,2862.5834906890
1982,"POPL","Extended naming conventions for communicating processes - Nissim Francez",982.9330675552,999.5554543208
1982,"POPL","Unbounded speed variability in distributed communication systems - John Reif Paul Spirakis",888.8574466658,2768.6310752101
1982,"POPL","Programming aspects of VLSI - Richard J. Lipton Robert Sedgewick Jacobo Valdes",429.0797528036,2817.4087690724
1982,"POPL","A flexible approach to interprocedural data flow analysis and programs with recursive data structures - Neil D. Jones Steven S. Muchnick",0.2442609380,0.2442609380
1982,"POPL","Automatic generation of machine specific code optimizers - Robert Giegerich",167.1529406312,1637.3355812448
1982,"POPL","Optimal code for control structures - M. V. S. Ramanath Marvin Solomon",160.2984821609,2348.1900397151
1983,"POPL","Five paradigm shifts in programming language design and their realization in Viron, a dataflow programming environment - Vaughan Pratt",2281.2605800070,1698.2279418690
1983,"POPL","Uncovering principles of novice programming - Jeffrey Bonar Elliot Soloway",75.9558299572,939.5326919187
1983,"POPL","Computer experiments with the <i>REVE</i> term rewriting system generator - Pierre Lescanne",1522.7141820662,978.7743398098
1983,"POPL","Precise typing of abstract data type specifications - Richard B. Kieburtz",1782.6681928245,656.8203290515
1983,"POPL","Automatic verification of finite state concurrent system using temporal logic specifications - E. M. Clarke E. A. Emerson A. P. Sistla",1325.4742970757,1062.0142248003
1983,"POPL","Sometimes and not never revisited - E. Allen Emerson Joseph Y. Halpern",1319.9621668418,2424.5263550342
1983,"POPL","How to cook a temporal proof system for your pet language - Zohar Manna Amir Pnueli",0.2442609380,0.2442609380
1983,"POPL","Structural semantics for polymorphic data types (preliminary report) - Daniel Leivant",970.7619615855,1423.7265602904
1983,"POPL","Incremental data flow analysis - Barbara G. Ryder",577.4165994707,1935.0719224053
1983,"POPL","Conversion of control dependence to data dependence - J. R. Allen Ken Kennedy Carrie Porterfield Joe Warren",98.2480633263,3947.2404585497
1983,"POPL","Loops in combinator-based compilers - Mitchell Wand",220.1819733145,1206.3065485615
1983,"POPL","Compilation of data-driven programs for synchronous execution - Janice E. Cuny Lawrence Snyder",0.2442609380,0.2442609380
1983,"POPL","Code generation for silicon - S. C. Johnson",169.6726184522,1272.8159034237
1983,"POPL","Summarizing graphs by regular expressions - Mark Wegman",163.2035635409,2739.2849583351
1983,"POPL","A program form based on data dependency in predicate regions - Jeanne Ferrante Karl J. Ottenstein",248.1818637861,3540.3066580899
1983,"POPL","Practical use of a polymorphic applicative language - Butler W. Lampson Eric E. Schmidt",5646.7773972087,1049.7111246672
1983,"POPL","On the unification of data and program abstraction in Ada - Peter Wegner",2715.9193914430,1211.5691304329
1983,"POPL","Incremental polymorphic type checking in <i>B</i> - Lambert Meertens",0.2442609380,0.2442609380
1983,"POPL","Mechanisms for compile-time enforcement of security - Robert E. Strom",1561.0644037988,1115.4241180772
1983,"POPL","Abstraction mechanisms in the BETA programming language - Bent Bruun Kristensen Ole Lehrmann Madsen Birger M&#248;ller-Pedersen Kristen Nygaard",2007.1280921090,1533.3604297670
1983,"POPL","Locality in software systems - Naftaly H. Minsky",3246.9747125139,1100.5138093621
1983,"POPL","Derivation of efficient DAG marking algorithms - R. J. R. Back Heikki Mannila Kari-Jouko R&#228;ih&#228;",70.5612489366,1969.9272729394
1983,"POPL","Reasoning about nonatomic operations - Leslie Lamport",0.2442609380,0.2442609380
1983,"POPL","Verifying reachability invariants of linked structures - Greg Nelson",581.5396908828,1591.9488309932
1983,"POPL","Practical program verification - John Nagle Scott Johnson",361.1551956681,2792.3333262079
1983,"POPL","Making variables abstract - Alan Demers James Donahue",3115.6752711394,1096.8132507365
1983,"POPL","Transformational programming - Robert Paige",206.9086225013,3788.5798993747
1983,"POPL","Polymorphic type inference - Daniel Leivant",0.2442609380,0.2442609380
1980,"POPL","Analysis of pointer rotation - Norihisa Suzuki",257.7947652811,2092.6937565949
1980,"POPL","Data types, parameters and type checking - Alan J. Demers James E. Donahue",1637.0499794080,428.4385424680
1980,"POPL","On specifying verifiers - V. R. Pratt",2390.3698180061,1348.1187038699
1980,"POPL","A case study in specifying the semantics of a programming language - Ravi Sethi",1828.2458333263,1487.2426885497
1980,"POPL","Final data type specifications - Samuel Kamin",1554.5247380684,864.9637838076
1980,"POPL","Expressiveness of the operation set of a data abstraction - Deepak Kapur Srivas Mandayam",2727.6184021016,2054.8701197744
1980,"POPL","On proving inductive properties of abstract data types - David R. Musser",311.7974155700,2482.6911063060
1980,"POPL","On the temporal analysis of fairness - Dov Gabbay Amir Pnueli Saharon Shelah Jonathan Stavi",809.2953575690,1446.1931643070
1980,"POPL","Sometime is sometimes not never - Leslie Lamport",2847.6369085075,1080.8516133685
1980,"POPL","Propositional logics of programs - Rohit Parikh",1068.5853280978,777.9031937782
1980,"POPL","A dynamic logic of multiprocessing with incomplete information - John H. Reif Gary L. Peterson",1852.2540178173,1059.2345040587
1980,"POPL","Axiomatic definitions of programming languages - Albert R. Meyer Joseph Y. Halpern",375.4708944686,2625.0176274074
1980,"POPL","A high-level approach to computer document formatting - Brian K. Reid",197.5363458523,1773.9521760237
1980,"POPL","Efficient algorithms for structural similarity of grammars - H. B. Hunt D. J. Rosenkrantz",41.7826046780,1965.7059171980
1980,"POPL","Theoretical and empirical studies on using program mutation to test the functional correctness of programs - Timothy A. Budd Richard A. DeMillo Richard J. Lipton Frederick G. Sayward",0.2442609380,0.2442609380
1980,"POPL","Type-completeness as a language principle - Alan Demers James Donahue",1543.3756271324,728.1128947435
1980,"POPL","An indeterminate constructor for applicative programming - Daniel P. Friedman David S. Wise",202.5164181410,1112.9721037350
1980,"POPL","Formal specification as a design tool - John Guttag J. J. Horning",357.1598622768,3419.3286595992
1980,"POPL","Experience with an applicative string processing language - James H. Morris Eric Schmidt Philip Wadler",535.5421262095,2601.9463956664
1980,"POPL","An overview of the SUMMER programming language - Paul Klint",252.5173328841,1408.9711889918
1980,"POPL","Analysis of simple programs over different sets of primitives - A. J. Kfoury",418.8066589133,618.6818629627
1980,"POPL","Synchronous schemes and their decision problems - Zohar Manna Amir Pnueli",87.0549122776,764.4336095984
1980,"POPL","Qualified data flow problems - L. Howard Holley Barry K. Rosen",1226.9777364957,3150.5107853803
1980,"POPL","Interprocedural data flow analysis in the presence of pointers, procedure variables, and label variables - William E. Weihl",703.1185712283,3098.3699506476
